object_id,tweet_id,created_at,from_user,to_user,tweet_text,filtered_text,core_text
navertalk,1.29504E+17,Thu Oct 27 19:26:30 KST 2011,uljima,null,틱톡 캐느려졌다... 가입자 늘었음 얼마나 늘었다고 벌써... 다시 카톡으로 가야하나.,틱톡 캐느려졌다 가입자 늘 늘 얼마 얼 늘 늘 벌쓰 다시 카톡 카톡으 가 가 가야 가야하 가야 가야하 가야하나 ,틱톡 캐느려졌다 가입자 늘 얼마 얼 늘 벌쓰 카톡 카톡으 가 가 가야 가야하 가야 가야하 가야하나 
navertalk,1.29504E+17,Thu Oct 27 19:26:13 KST 2011,changjo_kakung,jiyoung_0710,@jiyoung_0710 롯월에서차니오빠케이크주고 포옹한언니 카톡에  이제틴탑X 라고써져이씸,롯월에서차니오빠케이크주 포옹한언니 카톡 카톡 카톡에 이제틴탑x 라고써져이씸 ,롯월에서차니오빠케이크주 포옹한언니 카톡 카톡 카톡에 이제틴탑x 라고써져이씸 
navertalk,1.29504E+17,Thu Oct 27 19:26:12 KST 2011,jinyoov,null,두근두근 RT @BurgerKing_KOR: .금일 저녁에 카카오톡 버거킹 플러스 친구들에게 할로윈 스페셜로 그레이트 빅 E-쿠폰이 배포됩니다. 기존의 친구와 신규 포함 총 백만장이 배포가 됩니다. ^^ http://t.co/hcWLobQ9,두근두근 금일 금 금 저녁 카카오톡 버거킹 플러스 친구 할로윈 스페셜 스페셜 스페셜로 그레이트 빅 e 쿠폰 배포 기존 친구 신규 포함 포 포 총 백만장 배포 되 tagsmile ,두근두근 금일 금 금 저녁 카카오톡 버거킹 플러스 친구 할로윈 스페셜 스페셜 스페셜로 그레이트 빅 e 쿠폰 배포 기존 친구 신규 포함 포 포 총 백만장 배포 되 tagsmile 
navertalk,1.29504E+17,Thu Oct 27 19:25:43 KST 2011,hwangteza1,mjmonkey,@mjmonkey  ㅋㅋ 카카오톡하죠 아이디뭐임ㅋ,tagsmile 카카오톡하죠 아이디뭐 tagsmile ,tagsmile 카카오톡하죠 아이디뭐 tagsmile 
navertalk,1.29504E+17,Thu Oct 27 19:25:29 KST 2011,MyDestiny0131,null,"오늘 성적표의 참담함을 보고 제대로 카톡 계정을 삭제하고, 페이스북도 지웠고 트위터도 마지막. 시험끝나는 날쯤에나 잠깐잠깐 올게요.^^ 어짜피 성용이가 떠난 마당에 더이상 이유가 없다*^^* 열공하고 대학붙고 기쁘게다시만나용*.* 뿅! 연락은 문자로!",오늘 성적표 참담 참 보고 보 보 보 보 제 제대 카톡 계정 삭제 페이스북 페이스북 페이스북도 지우 트위터 트위터 트위터도 마지막 시험끝 시험끝 시험끝나 날쯤 날쯤에 날쯤 잠깐잠깐 올게 올게 올게요 tagsmile 어짜피 성용 성용이 성용이 성용이가 떠나 뜨 마당 더 이유 없 tagsmile 열공 열공 열공하 대학붙고 기쁘게다시만나용 뿅 tagexclamation 연락 문자 tagexclamation ,오늘 성적표 참담 참 보고 보 보 보 보 제 제대 카톡 계정 삭제 페이스북 페이스북 페이스북도 지우 트위터 트위터 트위터도 마지막 시험끝 시험끝 시험끝나 날쯤 날쯤에 날쯤 잠깐잠깐 올게 올게 올게요 tagsmile 어짜피 성용 성용이 성용이 성용이가 떠나 뜨 마당 이유 없 tagsmile 열공 열공 열공하 대학붙고 기쁘게다시만나용 뿅 tagexclamation 연락 문자 tagexclamation 
navertalk,1.29504E+17,Thu Oct 27 19:24:58 KST 2011,k20040214,narimee1216,@narimee1216 @ura0703 @zkzk2323 내카톡ㅇㄷㄴ 확인도 안함ㅋ,내카톡 ㅇㄷㄴ 확인 확 안하 tagsmile ,내카톡 ㅇㄷㄴ 확인 확 안하 tagsmile 
navertalk,1.29504E+17,Thu Oct 27 19:24:47 KST 2011,Mica_student,null,새벽 5시에 과제끝이라고 카톡와서 등교하면서 그러길래 미리미리 좀 하지 라고했다고 삐져서 카톡 씹는건 뭐야...내가 틀린말했어? 만날 늦잠에 틈만 나면 쳐자는 그 인간을 보며 대학교1학년은 다 저런가 싶다...작작 삐져!!!!,새벽 5시 5시 5시에 과제끝 과제끝 과제끝이 카톡와서 등교 그러길래 미리미리 좀 조 조 하지 하 하 하 라 라고 삐 카톡 씹는건 뭐 내 내 틀린말 tagquestion 만나 늦잠 틈 트 나 나 쳐자 쳐자 쳐자는 그 인간 보 보 대학교1 학년 다 저런가 싶 작작 삐 tagexclamation ,새벽 5시 5시 5시에 과제끝 과제끝 과제끝이 카톡와서 등교 그러길래 미리미리 좀 조 조 하지 하 하 하 라 라고 삐 카톡 씹는건 뭐 내 내 틀린말 tagquestion 만나 늦잠 틈 트 나 나 쳐자 쳐자 쳐자는 인간 보 보 대학교1 학년 다 저런가 싶 삐 tagexclamation 
navertalk,1.29504E+17,Thu Oct 27 19:24:39 KST 2011,jina1147,bychansung,@bychansung 아.. 그러게..그냥 잠시 스쳤던 사람이 갑자기 보내온 카톡이에여.. 세시간쯤 생각해보니 무슨 뜻인지 알것같네여. 결코 내가 원했던 미안함은 아니라는걸..,아 그러게 그냥 잠시 스치 사람 사 갑자기 보내 카톡이 카톡이에 카톡이에 카톡이에여 세시간쯤 생각 무슨 뜻 알것 알것같네 알것같네 알것같네여 결코 내 내 원하 미안 아니라는걸 ,아 그러게 잠시 스치 사람 사 보내 카톡이 카톡이에 카톡이에 카톡이에여 세시간쯤 생각 무슨 뜻 알것 알것같네 알것같네 알것같네여 내 내 원하 미안 아니라는걸 
navertalk,1.29504E+17,Thu Oct 27 19:24:32 KST 2011,lovely_ksj,0105ing,@0105ing ㅅ겨아 미안 나 직ㅁ 집와서 와파 인제된다 ㅠㅠ카톡할게!,ㅅ 겨아 미안 나 나 나 나 직 ㅁ 집와서 와파 인제된다 tagcry 카톡할게 tagexclamation ,ㅅ 겨아 미안 나 나 나 나 직 ㅁ 집와서 와파 인제된다 tagcry 카톡할게 tagexclamation 
navertalk,1.29504E+17,Thu Oct 27 19:24:25 KST 2011,nanta81,null,카카오톡에 번개마크뜨는건 왜그런거지? .,카카오톡 카카오톡 카카오톡에 번개마크뜨는건 왜그런거지 tagquestion ,카카오톡 카카오톡 카카오톡에 번개마크뜨는건 왜그런거지 tagquestion 
navertalk,1.29504E+17,Thu Oct 27 19:24:25 KST 2011,sadblue,null,“‘머리 빠져도’ 태도 좋아”…카톡 대화로 본 ‘2030 반란’ http://t.co/yPNG3Dw5,머리 빠지 태도 태 태 좋 카톡 대화 본 보 보 2030 반란 ,머리 빠지 태도 태 태 좋 카톡 대화 본 보 보 2030 반란 
navertalk,1.29504E+17,Thu Oct 27 19:23:35 KST 2011,kimjj119,null,외국에 있는 친구와 카톡으로 대화하고~ 참 스마트한 세상이야~^^,외국 있 친구 카톡 카톡으 대화 참 차 차 차 스마트 세상 tagsmile ,외국 있 친구 카톡 카톡으 대화 참 차 차 차 스마트 세상 tagsmile 
navertalk,1.29503E+17,Thu Oct 27 19:23:32 KST 2011,KyeongYun97,subymind21,@subymind21 맨날 카톡 하면 공부 한다면서ㅋ,매 맨 맨날 카톡 하 하 공부 하 하 tagsmile ,매 맨 맨날 카톡 하 하 공부 하 하 tagsmile 
navertalk,1.29503E+17,Thu Oct 27 19:23:27 KST 2011,Luv_D_0428,ckhalswo,@ckhalswo 카톡..?? 나 카톡안하는뎁;;,카톡 tagquestion 나 나 나 나 카톡안하는뎁 ,카톡 tagquestion 나 나 나 나 카톡안하는뎁 
navertalk,1.29503E+17,Thu Oct 27 19:23:27 KST 2011,yumeo77,null,징그럽게 카톡하네 지겹다,징그럽 카톡 카톡 카톡하네 지겹 ,카톡 카톡 카톡하네 지겹 
navertalk,1.29503E+17,Thu Oct 27 19:22:55 KST 2011,Airen_U,jin_ku,@jin_ku 얌. 마플깔아봐 나 카톡보기 힘들어 사무실에서,얌 마플깔아봐 나 나 나 나 카톡보기 힘들 사무실 ,얌 마플깔아봐 나 나 나 나 카톡보기 힘들 사무실 
navertalk,1.29503E+17,Thu Oct 27 19:22:42 KST 2011,yj502,null,자유로운 영혼이 많다 그중 한명 두달만에 연락와서 케냐에 있단다 지라니합창단 음악스텝으로.. 퇴근길 그녀의 카톡을 보며 마음이 살짝 뜬다...,자유롭 영혼 많 그중 한명 두달 두달 두달만 연락와서 케냐 케냐 케냐에 있 지라니합창단 음악스텝 퇴근길 그녀 그녀 그녀의 카톡 카톡 카톡을 보 보 마음 살짝 뜨 ,자유롭 영혼 많 그중 한명 두달 두달 두달만 연락와서 케냐 케냐 케냐에 있 지라니합창단 음악스텝 퇴근길 그녀 그녀 그녀의 카톡 카톡 카톡을 보 보 마음 살짝 뜨 
navertalk,1.29503E+17,Thu Oct 27 19:22:40 KST 2011,ura0703,narimee1216,@narimee1216 @zkzk2323 기뿌지!!!!!!!!1 몬일낫나 깜짝놀램... 카톡도 안되고 해가지고 막 유나님한테 혹시 키킹이랑 연락되냐고ㅠㅠ 잠수탓다고 막그러고 걱정했는데... 거바 내가 나타날꺼라고 했지!!!ㅋㅋㅋㅋ,기뿌지 tagexclamation 1 몬일낫 몬일낫 몬일낫나 깜짝놀램 카톡 카톡 카톡도 안 해가지 해가지 해가지고 막 유나님한테 혹시 키킹 키킹 키킹이 연락 tagcry 잠수탓다 막그러 막그러 막그러고 걱정 거바 내 내 나타날꺼 나타날꺼 나타날꺼라 하 하 tagexclamation tagsmile ,기뿌지 tagexclamation 1 몬일낫 몬일낫 몬일낫나 깜짝놀램 카톡 카톡 카톡도 안 해가지 해가지 해가지고 막 유나님한테 키킹 키킹 키킹이 연락 tagcry 잠수탓다 막그러 막그러 막그러고 걱정 거바 내 내 나타날꺼 나타날꺼 나타날꺼라 하 하 tagexclamation tagsmile 
navertalk,1.29503E+17,Thu Oct 27 19:22:32 KST 2011,ekdud0729,null,......졸려ㅠ긍데어제부터왜케카톡에친구추천이뜨는것이야?...평소때는뜨지도않더니꼭기다리고잇을때ㅡㅡ,졸 조 졸 tagcry 긍데어제부터왜케카톡에친구추천이뜨는것 tagquestion 평소때는뜨지도않더니꼭기다리고잇을때 tagcry ,졸 조 졸 tagcry 긍데어제부터왜케카톡에친구추천이뜨는것 tagquestion 평소때는뜨지도않더니꼭기다리고잇을때 tagcry 
navertalk,1.29503E+17,Thu Oct 27 19:22:22 KST 2011,ONLY13seonghee,null,RT @sjplus13: 서울 엞 정모 날짜 11월 12일 or 13일 시간 미정 장소 명동 (사람이 많을경우 카폐같은곳 예약할 예정) 콘서트 입장/놀러오시는 엞뿐만 아닌 모든 엞이 친목 할 수 있도록 돕고자함 -참석하실분 제 카톡 아이디나 번호 궁금하신분 멘션/DM 주셔와요,서울 엞 정모 날짜 11월 12 12 12일 13 13 13일 시간 미정 장소 명동 사람 사 많을경우 카폐같은곳 예약 예정 콘서트 입장 놀러오 엞뿐 엞뿐 엞뿐만 아니 아 모 엞 엞 엞이 친목 할 하 하 하 수 있 돕 돕고자 돕고자함 참석하실분 제 카톡 아 아이디 아이디나 번호 궁금하신분 멘션 dm 주셔 주셔와 주셔와 주셔와요 ,서울 엞 정모 날짜 11월 12 12 12일 13 13 13일 시간 미정 장소 명동 사람 사 많을경우 카폐같은곳 예약 예정 콘서트 입장 놀러오 엞뿐 엞뿐 엞뿐만 아니 아 모 엞 엞 엞이 친목 할 하 하 하 수 있 돕 돕고자 돕고자함 참석하실분 제 카톡 아 아이디 아이디나 번호 궁금하신분 멘션 dm 주셔 주셔와 주셔와 주셔와요 
navertalk,1.29503E+17,Thu Oct 27 19:22:19 KST 2011,0_0HEE_,114816,@114816 ㅋㅋㅋㅋㅋㅋㅋㅋㅋㅋㅋㅋㅋㅋㅋㅋㅋㅋ아냐 카톡해도 버노없을수도있잖아.....,tagsmile 아냐 카톡 카톡 카톡해 카톡 카톡해 카톡해도 버노없을수도있잖아 ,tagsmile 아냐 카톡 카톡 카톡해 카톡 카톡해 카톡해도 버노없을수도있잖아 
navertalk,1.29503E+17,Thu Oct 27 19:22:18 KST 2011,kkangjii_U,null,"으헤헤>_< 오빠야 짱!!_!! ""@H_Vv_U: 깡지밖에없음♥""@kkangjii_U: @H_Vv_U 우아....지짜 영광이다잉>_< ....내가 한말 다 진심이니깐 잊지마!!! 힘들면 언제든지 기대!! 디엠 멘션 문자 전화 카톡 다 열려잇습니다용♥.",으헤헤 오빠 짱 tagexclamation tagexclamation 깡지 깡지밖 taglove 우아 지짜 영광이다잉 내 내 한말 다 진심 잊지마 tagexclamation 힘들 언제 기대 기대 기대 기대 tagexclamation 디엠 멘션 문자 전화 카톡 다 열려잇습니다용 taglove ,으헤헤 오빠 짱 tagexclamation tagexclamation 깡지 깡지밖 taglove 우아 지짜 영광이다잉 내 내 한말 다 진심 잊지마 tagexclamation 힘들 언제 기대 기대 기대 기대 tagexclamation 디엠 멘션 문자 전화 카톡 다 열려잇습니다용 taglove 
navertalk,1.29503E+17,Thu Oct 27 19:22:10 KST 2011,tmk_0214,loveaffair104,@loveaffair104 카톡이모티콘이라서 그런가...,카톡이모티콘 카톡이모티콘 카톡이모티콘이 그런가 ,카톡이모티콘 카톡이모티콘 카톡이모티콘이 그런가 
navertalk,1.29503E+17,Thu Oct 27 19:22:08 KST 2011,kanonj13,sunhyekim,@sunhyekim 헉...ㅋ삐삐 번호가 카톡을 말한다 오버^^ 내가 요즘 트윗 잘 안해서리...ㅋ,헉 tagsmile 삐삐 번호 카톡 카톡 카톡을 말 말 오버 tagsmile 내 내 요즘 트윗 잘 자 자 자 안해서리 tagsmile ,헉 tagsmile 삐삐 번호 카톡 카톡 카톡을 말 말 오버 tagsmile 내 내 요즘 트윗 잘 자 자 자 안해서리 tagsmile 
navertalk,1.29503E+17,Thu Oct 27 19:21:55 KST 2011,Sisyphuss,babysong_,"@babysong_ 악! 난 카톡 오타를 지적한건데!!! ㅋㅋㅋㅋㅋㅋ 나와, 족발먹으러 가자, ㅋㅋㅋㅋㅋㅋ",악 tagexclamation 난 나 날 나 나 날 나 카톡 오타 오타 오타를 지적한건데 tagexclamation tagsmile 나 나 나 족발먹으러 가자 가 가 가 tagsmile ,악 tagexclamation 난 나 날 나 나 날 나 카톡 오타 오타 오타를 지적한건데 tagexclamation tagsmile 나 나 나 족발먹으러 가자 가 가 가 tagsmile 
navertalk,1.29503E+17,Thu Oct 27 19:21:54 KST 2011,ads2448,Yesoling1103,@Yesoling1103 @heesu0204 ㅋㅋㅋㅋㅋㅋ 왜어때 트윗을카톡처럼 쓰면안되?ㅋㅋㅋ,tagsmile 왜어때 트윗을카톡 쓰면안되 tagquestion tagsmile ,tagsmile 왜어때 트윗을카톡 쓰면안되 tagquestion tagsmile 
navertalk,1.29503E+17,Thu Oct 27 19:21:50 KST 2011,Keialkr,null,온스타일 카톡플러스 좋은데? 겟잇뷰티 블라인드테스트 결과가 보내져온다! B사 이러케 안나와서좋구나~,온스타일 온스타 온스타 카톡플러스 좋 tagquestion 겟잇뷰티 블라인드테스트 결과 결 보내져온다 tagexclamation b사 이러케 안나와서좋구 안나와서좋구 안나와서좋구나 ,온스타일 온스타 온스타 카톡플러스 좋 tagquestion 겟잇뷰티 블라인드테스트 결과 결 보내져온다 tagexclamation b사 이러케 안나와서좋구 안나와서좋구 안나와서좋구나 
navertalk,1.29503E+17,Thu Oct 27 19:21:41 KST 2011,H_Vv_U,null,"깡지밖에없음♥""@kkangjii_U: @H_Vv_U 우아....지짜 영광이다잉>_< ....내가 한말 다 진심이니깐 잊지마!!! 힘들면 언제든지 기대!! 디엠 멘션 문자 전화 카톡 다 열려잇습니다용♥.♥""",깡지 깡지밖 taglove 우아 지짜 영광이다잉 내 내 한말 다 진심 잊지마 tagexclamation 힘들 언제 기대 기대 기대 기대 tagexclamation 디엠 멘션 문자 전화 카톡 다 열려잇습니다용 taglove taglove ,깡지 깡지밖 taglove 우아 지짜 영광이다잉 내 내 한말 다 진심 잊지마 tagexclamation 힘들 언제 기대 기대 기대 기대 tagexclamation 디엠 멘션 문자 전화 카톡 다 열려잇습니다용 taglove taglove 
navertalk,1.29503E+17,Thu Oct 27 19:21:37 KST 2011,a_a0224,alicerish,@alicerish 언니저 망할.. 쿠폰이 왓는데 카톡이 안열리는 이런 망할상황,언니저 망 쿠폰 왓는데 카톡 카톡 카톡이 안열리 안열리 안열리는 이런 망할상황 ,언니저 망 쿠폰 왓는데 카톡 카톡 카톡이 안열리 안열리 안열리는 망할상황 
navertalk,1.29503E+17,Thu Oct 27 19:21:34 KST 2011,JooNooL,blueboy528,@blueboy528 ㅇㅇ 그래서 카톡중ㅋ,ㅇㅇ 그래서 카톡중 tagsmile ,ㅇㅇ 카톡중 tagsmile 
navertalk,1.29503E+17,Thu Oct 27 19:21:26 KST 2011,xxtra_Ordinary,NZSpitter,@NZSpitter 상후나 나 카톡만들엇엉 아이디줘,상후 상후 상후나 나 나 나 나 카톡만들엇엉 아이디줘 ,상후 상후 상후나 나 나 나 나 카톡만들엇엉 아이디줘 
navertalk,1.29503E+17,Thu Oct 27 19:21:10 KST 2011,hn0416,myeowook,@myeowook 난괜찮아! 아직은! 미와코는 스마트폰?? 카카오톡 알아?,난괜찮 난괜찮 난괜찮아 tagexclamation 아직 아직 아직은 tagexclamation 미와코 미와코 미와코는 스마트폰 tagquestion 카카오톡 알 알 tagquestion ,난괜찮 난괜찮 난괜찮아 tagexclamation 아직 아직 아직은 tagexclamation 미와코 미와코 미와코는 스마트폰 tagquestion 카카오톡 알 알 tagquestion 
navertalk,1.29503E+17,Thu Oct 27 19:21:08 KST 2011,kkangjii_U,H_Vv_U,@H_Vv_U 우아....지짜 영광이다잉>_< ....내가 한말 다 진심이니깐 잊지마!!! 힘들면 언제든지 기대!! 디엠 멘션 문자 전화 카톡 다 열려잇습니다용♥.♥,우아 지짜 영광이다잉 내 내 한말 다 진심 잊지마 tagexclamation 힘들 언제 기대 기대 기대 기대 tagexclamation 디엠 멘션 문자 전화 카톡 다 열려잇습니다용 taglove taglove ,우아 지짜 영광이다잉 내 내 한말 다 진심 잊지마 tagexclamation 힘들 언제 기대 기대 기대 기대 tagexclamation 디엠 멘션 문자 전화 카톡 다 열려잇습니다용 taglove taglove 
navertalk,1.29503E+17,Thu Oct 27 19:20:51 KST 2011,114816,0_0HEE_,@0_0HEE_ 넌 당인혀ㅣ 이땈ㅋㅋㅋㅋㅋㅋㅋㅋ 카톡해짜나 바부얔ㅋㅋㅋㅋ,넌 널 널 널 당인혀 ㅣ 이땈 tagsmile 카톡해짜 카톡해짜 카톡해짜나 바부얔 tagsmile ,넌 널 널 널 당인혀 ㅣ 이땈 tagsmile 카톡해짜 카톡해짜 카톡해짜나 바부얔 tagsmile 
navertalk,1.29503E+17,Thu Oct 27 19:20:42 KST 2011,ura0703,narimee1216,@narimee1216 @zkzk2323 ㅋㅋㅋㅋ응응 카톡ㅎㅏ고이써...히히히히 카톡 답장와가꼬 깜짝 놀래서 디바한테 멘션날릴려고 보니까 키킹이 벌써 날려놔서 가많 있었지요,tagsmile 응응 카톡 tagsmile ㅏ 고이써 히히 히히히 히히히 히히히히 카톡 답장와가꼬 깜짝 놀 놀래 디바한테 멘션날릴려 멘션날릴려 멘션날릴려고 보 키킹 키킹 키킹이 벌쓰 날려놔서 가많 있 ,tagsmile 응응 카톡 tagsmile ㅏ 고이써 히히 히히히 히히히 히히히히 카톡 답장와가꼬 놀 놀래 디바한테 멘션날릴려 멘션날릴려 멘션날릴려고 보 키킹 키킹 키킹이 벌쓰 날려놔서 가많 있 
navertalk,1.29503E+17,Thu Oct 27 19:20:38 KST 2011,marine6961,null,"오늘 12시14분 아들한테서 날아온 카톡문자~!!! http://t.co/ZBIGrCCV ""아빠 고생이많네 박원순이가 됐넹 ㅎㅎ ㅊㅊ늦게까지 일하는 우리아빠..ㅠㅠ힘내시공!! 싸랑행 (하트)(...",오늘 12시14 분 아들한테서 날아오 카톡문자 tagexclamation 아빠 고생이많네 박원순 박원순이 박원순이 박원순이가 됐넹 tagsmile ㅊㅊ 늦 일하 우리아빠 tagcry 힘내시공 tagexclamation 싸랑행 하트 ,오늘 12시14 분 아들한테서 날아오 카톡문자 tagexclamation 아빠 고생이많네 박원순 박원순이 박원순이 박원순이가 됐넹 tagsmile ㅊㅊ 늦 일하 우리아빠 tagcry 힘내시공 tagexclamation 싸랑행 하트 
navertalk,1.29503E+17,Thu Oct 27 19:20:30 KST 2011,giwoon_,jungeun0223,@jungeun0223 잉 카톡하는데?? 오늘은 안해서 몰것다,잉 카톡 카톡 카톡하는데 tagquestion 오늘 안하 몰 ,잉 카톡 카톡 카톡하는데 tagquestion 오늘 안하 몰 
navertalk,1.29503E+17,Thu Oct 27 19:20:18 KST 2011,andNR,null,카카오톡 새로운 시스템 얘기 들으니 가관이군. 쯔읍:),카카오톡 새롭 시스템 얘기 들 가관 쯔읍 ,카카오톡 새롭 시스템 얘기 들 가관 쯔읍 
navertalk,1.29503E+17,Thu Oct 27 19:19:51 KST 2011,kkurykkurygo,null,나 오늘은 지인짜 일찍잘거야 문자 카톡 다 빠잉ㅋ 나만의 시간이야! 로또랑 토토만 허락하는거임~~,나 나 나 나 오늘 지인짜 일찍잘거 문자 카톡 다 빠잉 tagsmile 나 나 시간 tagexclamation 로또 로또 로또랑 토토 토토 토토만 허락하는거 ,나 나 나 나 오늘 지인짜 일찍잘거 문자 카톡 다 빠잉 tagsmile 나 나 시간 tagexclamation 로또 로또 로또랑 토토 토토 토토만 허락하는거 
navertalk,1.29503E+17,Thu Oct 27 19:19:41 KST 2011,YonnetheLea,greedyboyjup,@greedyboyjup 카톡봐줭..,카톡봐줭 ,카톡봐줭 
navertalk,1.29502E+17,Thu Oct 27 19:19:17 KST 2011,adrienne8787,null,카톡도 조용하고 트윗도 조용하고 다 어디들 가셨수 억만년 만에 트윗 정복이나 해볼까.,카톡 카톡 카톡도 조용 트윗 트윗 트윗도 조용 다 어디 가셨수 억만년 만 말 트윗 정복 정복 해보 ,카톡 카톡 카톡도 조용 트윗 트윗 트윗도 조용 다 어디 가셨수 억만년 만 말 트윗 정복 정복 해보 
navertalk,1.29502E+17,Thu Oct 27 19:19:10 KST 2011,Ra2_Lee,MiNHeE_87,@MiNHeE_87 친구 앞에서 트윗카톡은 예의가 아닌거 같아서 잘 안해 ㅎㅎ #20대,친구 앞 트윗카톡 트윗카톡 트윗카톡은 예의 예 아닌거 같 잘 자 자 자 안하 tagsmile 20대 ,친구 앞 트윗카톡 트윗카톡 트윗카톡은 예의 예 아닌거 같 잘 자 자 자 안하 tagsmile 20대 
navertalk,1.29502E+17,Thu Oct 27 19:19:06 KST 2011,onsoonh,null,근데 카톡이 설치된사람자동으로 등록되주는거면 그사람삭제나.... 혹은상대방이 나한테 카톡안되게는 못하나... 오빠가 떠서 서먹해졌다.,근데 카톡 카톡 카톡이 설치된사람자동 등록되주는거면 그사람삭제 혹은상대방 나한테 카톡안 카톡안 카톡안되게 카톡안 카톡안되게 카톡안되게는 못하 못하 오빠 뜨 서먹 ,근데 카톡 카톡 카톡이 설치된사람자동 등록되주는거면 그사람삭제 혹은상대방 나한테 카톡안 카톡안 카톡안되게 카톡안 카톡안되게 카톡안되게는 못하 못하 오빠 뜨 서먹 
navertalk,1.29502E+17,Thu Oct 27 19:19:02 KST 2011,lovelyeun3630,null,책읽으려고 책 꺼냈다가 카톡 답장하나만 하려고 했는데 내릴역에 다왔다. 흐미 이거머여 ㅠ.ㅠ,책읽으려 책읽으려 책읽으려고 책 꺼내 카톡 답장 답장하 답장하나 답장하나만 하 하 하 하 내릴역 내릴역 내릴역에 다오 흐미 이거머 이거머 이거머여 tagcry tagcry ,책읽으려 책읽으려 책읽으려고 책 꺼내 카톡 답장 답장하 답장하나 답장하나만 하 하 하 하 내릴역 내릴역 내릴역에 다오 흐미 이거머 이거머 이거머여 tagcry tagcry 
navertalk,1.29502E+17,Thu Oct 27 19:19:01 KST 2011,Bird_Rom,null,카톡아직도모르겠다,카톡아직도모르겠다 ,카톡아직도모르겠다 
navertalk,1.29502E+17,Thu Oct 27 19:18:36 KST 2011,Mirasu_Soul,null,RT @8chR: 자꾸 얼마전부터 이상하게 와이파이 연결되도 신호가 없다하고 ㅠ 3g 속도도 엄청 느려졌다고 느껴질때가 있는데.. 통신사 문제일까요 폰문제일까요 ㅜ 카톡도 자꾸 몰아서 오고 ㅜ 이건 카톡문제인가 ㅠ,자꾸 얼마전 이상 와이파 와이파 와이파이 연결되 연결되 연결되도 신호 없 tagcry 3g 속도 속 엄청 느리 느껴질때 느껴질때 느껴질때가 있 통신사 문제 폰문제 폰문제 폰문제일까 폰문제 폰문제일까 폰문제일까요 tagcry 카톡 카톡 카톡도 자꾸 몰 오 오 tagcry 이건 카톡문제인가 tagcry ,자꾸 얼마전 이상 와이파 와이파 와이파이 연결되 연결되 연결되도 신호 없 tagcry 3g 속도 속 엄청 느리 느껴질때 느껴질때 느껴질때가 있 통신사 문제 폰문제 폰문제 폰문제일까 폰문제 폰문제일까 폰문제일까요 tagcry 카톡 카톡 카톡도 자꾸 몰 오 오 tagcry 이건 카톡문제인가 tagcry 
navertalk,1.29502E+17,Thu Oct 27 19:18:16 KST 2011,jihye98,null,카톡 프로필사진에 그날그날 자기 심리상태를 그림으로 올리시는분이 있는데 잼있다. 그리고 넘 닮았어요...! http://t.co/NMaVpIcB,카톡 프로필사진 그날그날 그날그 그날그 자기 자 자 자 심리상태 그리 그림 그리 올리시는분 올리시는분 올리시는분이 있 잼 재 그리고 그리 그리 넘 닮 tagexclamation ,카톡 프로필사진 그날그 그날그 자기 자 자 자 심리상태 그리 그림 그리 올리시는분 올리시는분 올리시는분이 있 잼 재 그리 그리 넘 닮 tagexclamation 
navertalk,1.29502E+17,Thu Oct 27 19:18:08 KST 2011,HOHOWONA,winter_child24,@winter_child24 사촌동생이랑 카톡하다가 좀 그럴일이 있어서 우울해서 길거리에 앉아서 청승떤거 그러니 니탓없떵 걱정마~,사촌동생 카톡 카톡 카톡하 카톡 카톡하 카톡하다 좀 조 조 그럴 그럴일 그럴일 그럴일이 있 우울 길거리 앉 청승떤거 그러 그르 니탓없떵 걱정마 ,사촌동생 카톡 카톡 카톡하 카톡 카톡하 카톡하다 좀 조 조 그럴 그럴일 그럴일 그럴일이 있 우울 길거리 앉 청승떤거 그르 니탓없떵 걱정마 
navertalk,1.29502E+17,Thu Oct 27 19:17:58 KST 2011,Baby980121,helloim_IH,@helloim_IH 야싸 캡쳐해서 카톡으로 보냄^^,야싸 캡쳐 캡쳐 캡쳐해서 카톡 카톡으 보내 tagsmile ,야싸 캡쳐 캡쳐 캡쳐해서 카톡 카톡으 보내 tagsmile 
navertalk,1.29502E+17,Thu Oct 27 19:17:48 KST 2011,Hrin_Ss3,null,저년은 카톡을 하는건지 멘션을 보내는건지..답이없다ㅋ,저년 저년 저년은 카톡 카톡 카톡을 하는건지 멘션 멘션 멘션을 보내는건지 답 tagsmile ,저년 저년 저년은 카톡 카톡 카톡을 하는건지 멘션 멘션 멘션을 보내는건지 답 tagsmile 
