object_id,tweet_id,created_at,from_user,to_user,tweet_text,filtered_text,core_text
navertalk,1.29499E+17,Thu Oct 27 19:05:45 KST 2011,fromscratchz,rkd5446,@rkd5446 헐ㅜㅜ 혹시 카톡하나..,헐 tagcry 혹시 카톡 카톡 카톡하 카톡 카톡하 카톡하나 ,헐 tagcry 카톡 카톡 카톡하 카톡 카톡하 카톡하나 
navertalk,1.29499E+17,Thu Oct 27 19:05:33 KST 2011,choi_myung_gil,superminnp,@superminnp 선배님ㅋ제카톡은 시니컬하게 답해주시고는ㅋㅋ이렇게 정성스런 트윗을!!!,선배님 tagsmile 제카톡 제카톡 제카톡은 시니컬 답 tagsmile 이렇게 정성스런 트윗 트윗 트윗을 tagexclamation ,선배님 tagsmile 제카톡 제카톡 제카톡은 시니컬 답 tagsmile 이렇게 정성스런 트윗 트윗 트윗을 tagexclamation 
navertalk,1.29499E+17,Thu Oct 27 19:05:29 KST 2011,Yell4t,Sein727,@Sein727 우왕 일어시간에 이런것도 하는구낭ㅋ 신기하다 난 수학여행때 함 입어봤긔ㅋㅋ 난주 카톡으로 사진 보여줌ㅋㅋㅋㅋ,우왕 일어시간 이런것 이런것 이런것도 하는구낭 tagsmile 신기 신 난 나 날 나 나 날 나 수학여행때 함 하 하 하 입어봤긔 tagsmile 난주 카톡 카톡으 사진 사 사 사 보여주 tagsmile ,우왕 일어시간 이런것 이런것 이런것도 하는구낭 tagsmile 신기 신 난 나 날 나 나 날 나 수학여행때 함 하 하 하 입어봤긔 tagsmile 난주 카톡 카톡으 사진 사 사 사 보여주 tagsmile 
navertalk,1.29499E+17,Thu Oct 27 19:05:27 KST 2011,pzs3265,Unti_melrody,@Unti_melrody 카톡을 잘 안해서 아디를 까먹엇어 ㅋㅋ 찾아볼게 ㅋㅋ,카톡 카톡 카톡을 잘 자 자 자 안하 아디 아디 아디를 까먹엇어 tagsmile 찾아볼게 tagsmile ,카톡 카톡 카톡을 잘 자 자 자 안하 아디 아디 아디를 까먹엇어 tagsmile 찾아볼게 tagsmile 
navertalk,1.29499E+17,Thu Oct 27 19:05:15 KST 2011,oyj990528,null,카톡잇는사람!!,카톡잇는사람 tagexclamation ,카톡잇는사람 tagexclamation 
navertalk,1.29499E+17,Thu Oct 27 19:05:06 KST 2011,Tany_kim,null,귀엽다... RT @micky_vo_ov: 범죄를예방합시다 RT @Marbas_ 말리지마 지금 카톡하는 중딩한테 고백해버릴거야,귀엽 범죄를예방합시 말리지마 지금 카톡 카톡 카톡하 카톡 카톡하 카톡하는 중딩한테 고백해버릴거 ,귀엽 범죄를예방합시 말리지마 지금 카톡 카톡 카톡하 카톡 카톡하 카톡하는 중딩한테 고백해버릴거 
navertalk,1.29499E+17,Thu Oct 27 19:04:54 KST 2011,All_Ta,syndromey,@syndromey 너와는카톡ㅇ로^^,너와는카톡 ㅇ 로 tagsmile ,너와는카톡 ㅇ 로 tagsmile 
navertalk,1.29499E+17,Thu Oct 27 19:04:41 KST 2011,Ingyolss,null,잡았다 요놈 RT @micky_vo_ov: 범죄를예방합시다 RT @Marbas_ 말리지마 지금 카톡하는 중딩한테 고백해버릴거야,잡 요놈 범죄를예방합시 말리지마 지금 카톡 카톡 카톡하 카톡 카톡하 카톡하는 중딩한테 고백해버릴거 ,잡 요놈 범죄를예방합시 말리지마 지금 카톡 카톡 카톡하 카톡 카톡하 카톡하는 중딩한테 고백해버릴거 
navertalk,1.29499E+17,Thu Oct 27 19:04:37 KST 2011,yonago2004,_JH0408,@_JH0408 그를...까영?ㅠ요새아부이는제가좀커서징그럽다고카톡프사도동생껄루해놧쓰영..ㅜㅡ3ㅡ..오늘은애교를부리며..ㅋㅋ이런눈으로~_~로쳐다볼까무셔요ㅠㅋ,그 그르 까영 tagquestion tagcry 요새아부이는제가좀커서징그럽다고카톡프사도동생껄루해놧쓰영 tagcry ㅡ 3 ㅡ 오늘은애교를부리 tagsmile 이런눈 이런눈으 로쳐다볼까무셔 로쳐다볼까무셔 로쳐다볼까무셔요 tagcry tagsmile ,그르 까영 tagquestion tagcry 요새아부이는제가좀커서징그럽다고카톡프사도동생껄루해놧쓰영 tagcry ㅡ 3 ㅡ 오늘은애교를부리 tagsmile 이런눈 이런눈으 로쳐다볼까무셔 로쳐다볼까무셔 로쳐다볼까무셔요 tagcry tagsmile 
navertalk,1.29499E+17,Thu Oct 27 19:04:26 KST 2011,wishYH,polinlove,@polinlove 카카오톡으로 스팸문자보내고 카카오톡으로 인신매매시도하기도 하던데..조사좀해주세요ㅠㅠ 이건 제가 받은 스팸카톡이에요http://t.co/Eg2UReTh,카카오톡 카카오톡으 스팸문자보 카카오톡 카카오톡으 인신매매시도 인신매매시 하 하 조사좀해주세 tagcry 이건 제가 제 제 받 스팸카톡이에요 ,카카오톡 카카오톡으 스팸문자보 카카오톡 카카오톡으 인신매매시도 인신매매시 하 하 조사좀해주세 tagcry 이건 제가 제 제 받 스팸카톡이에요 
navertalk,1.29499E+17,Thu Oct 27 19:04:21 KST 2011,Unti_melrody,pzs3265,@pzs3265 ㅋㅋ합격되면꼭알려드릴께요!!아!!카톡아이디적어주세요~,tagsmile 합격되면꼭알려 tagexclamation 아 tagexclamation 카톡아이디적어주세 카톡아이디적어주세 카톡아이디적어주세요 ,tagsmile 합격되면꼭알려 tagexclamation 아 tagexclamation 카톡아이디적어주세 카톡아이디적어주세 카톡아이디적어주세요 
navertalk,1.29499E+17,Thu Oct 27 19:04:20 KST 2011,swjw0509,pcn02244,@pcn02244 ㅇㅇㅇ.. 일어나면카톡이어서해라..,ㅇㅇㅇ 일어나면카톡이어서해 ,ㅇㅇㅇ 일어나면카톡이어서해 
navertalk,1.29499E+17,Thu Oct 27 19:04:03 KST 2011,rainyearth,Pei007,@Pei007 그래서 배배님 카톡에서 사라졌쿤.,그래서 배배님 카톡 사라졌쿤 ,배배님 카톡 사라졌쿤 
navertalk,1.29498E+17,Thu Oct 27 19:03:36 KST 2011,thextran,null,화장실에 신문이 없다.. RT @mover9: RT @kennedian3: 조중동 등 기득권 언론의 주독자층은 50대 이상으로 40대 이하 독자층은 씨가 마른 상태. 2040세대는 트위터 카톡과 나꼼수 등 SNS세대. SNS세대를 통제할 수는 없습니다,화장실 신문 없 조중동 등 기득권 언론 주독자층 50대 이상 40대 이하 독자층 씨 마르 상태 2040세대 트위터 카톡 카톡 카톡과 나꼼수 등 sns세대 sns세대 통제 수 없 ,화장실 신문 없 조중동 등 기득권 언론 주독자층 50대 이상 40대 이하 독자층 씨 마르 상태 2040세대 트위터 카톡 카톡 카톡과 나꼼수 등 sns세대 sns세대 통제 수 없 
navertalk,1.29498E+17,Thu Oct 27 19:03:34 KST 2011,bandoche,null,둘다요. RT @8chR: 자꾸 얼마전부터 이상하게 와이파이 연결되도 신호가 없다하고 ㅠ 3g 속도도 엄청 느려졌다고 느껴질때가 있는데.. 통신사 문제일까요 폰문제일까요 ㅜ 카톡도 자꾸 몰아서 오고 ㅜ 이건 카톡문제인가 ㅠ,둘다 둘다 둘다요 자꾸 얼마전 이상 와이파 와이파 와이파이 연결되 연결되 연결되도 신호 없 tagcry 3g 속도 속 엄청 느리 느껴질때 느껴질때 느껴질때가 있 통신사 문제 폰문제 폰문제 폰문제일까 폰문제 폰문제일까 폰문제일까요 tagcry 카톡 카톡 카톡도 자꾸 몰 오 오 tagcry 이건 카톡문제인가 tagcry ,둘다 둘다 둘다요 자꾸 얼마전 이상 와이파 와이파 와이파이 연결되 연결되 연결되도 신호 없 tagcry 3g 속도 속 엄청 느리 느껴질때 느껴질때 느껴질때가 있 통신사 문제 폰문제 폰문제 폰문제일까 폰문제 폰문제일까 폰문제일까요 tagcry 카톡 카톡 카톡도 자꾸 몰 오 오 tagcry 이건 카톡문제인가 tagcry 
navertalk,1.29498E+17,Thu Oct 27 19:03:32 KST 2011,eunjikim97,becalmmy,@becalmmy  카톡카톡,카톡카톡 ,카톡카톡 
navertalk,1.29498E+17,Thu Oct 27 19:03:31 KST 2011,merrong1118,kh_young,@kh_young 나도저나나카톡이나틱톡좀해보자......................................,나도저나나카톡이나틱톡좀해보자 ,나도저나나카톡이나틱톡좀해보자 
navertalk,1.29498E+17,Thu Oct 27 19:03:26 KST 2011,NMyun,null,RT @BurgerKing_KOR: .금일 저녁에 카카오톡 버거킹 플러스 친구들에게 할로윈 스페셜로 그레이트 빅 E-쿠폰이 배포됩니다. 기존의 친구와 신규 포함 총 백만장이 배포가 됩니다. ^^  http://t.co/22Svtadh,금일 금 금 저녁 카카오톡 버거킹 플러스 친구 할로윈 스페셜 스페셜 스페셜로 그레이트 빅 e 쿠폰 배포 기존 친구 신규 포함 포 포 총 백만장 배포 되 tagsmile ,금일 금 금 저녁 카카오톡 버거킹 플러스 친구 할로윈 스페셜 스페셜 스페셜로 그레이트 빅 e 쿠폰 배포 기존 친구 신규 포함 포 포 총 백만장 배포 되 tagsmile 
navertalk,1.29498E+17,Thu Oct 27 19:03:23 KST 2011,micky_vo_ov,null,범죄를예방합시다 RT @Marbas_ 말리지마 지금 카톡하는 중딩한테 고백해버릴거야,범죄를예방합시 말리지마 지금 카톡 카톡 카톡하 카톡 카톡하 카톡하는 중딩한테 고백해버릴거 ,범죄를예방합시 말리지마 지금 카톡 카톡 카톡하 카톡 카톡하 카톡하는 중딩한테 고백해버릴거 
navertalk,1.29498E+17,Thu Oct 27 19:03:23 KST 2011,chr4634,Edit_moon,@Edit_moon 액셀! 카톡도 되니 갈아탈만하죠 베타버젼이라 구리다는게 함정 아이폰 공기계 안버리고 쓰면어플도 해결되공,액셀 tagexclamation 카톡 카톡 카톡도 되 되 갈아탈만하죠 베타버젼 구리다는게 함정 아이폰 공기계 안버리 안버리 안버리고 쓰면어플 쓰면어플 쓰면어플도 해결되공 ,액셀 tagexclamation 카톡 카톡 카톡도 되 되 갈아탈만하죠 베타버젼 구리다는게 함정 아이폰 공기계 안버리 안버리 안버리고 쓰면어플 쓰면어플 쓰면어플도 해결되공 
navertalk,1.29498E+17,Thu Oct 27 19:03:17 KST 2011,li1342,null,카톡겁나팅기네ㅡㅡ,카톡겁나팅기네 tagcry ,카톡겁나팅기네 tagcry 
navertalk,1.29498E+17,Thu Oct 27 19:03:16 KST 2011,YUJIN980811,B1A40423,@B1A40423 그래갖고지금못하구이썽ㅜㅠㅠ이따집에오면카톡한대!!!,그래갖고지금못하구이썽 tagcry tagcry 이따집에오면카톡한대 tagexclamation ,그래갖고지금못하구이썽 tagcry tagcry 이따집에오면카톡한대 tagexclamation 
navertalk,1.29498E+17,Thu Oct 27 19:03:09 KST 2011,Ra2_Lee,null,#20대 퇴근했으나 바로 친구만나러 가는중.. 카톡은 갑자기 급 맛감 ㅠㅠ,20대 퇴근 퇴근했으 바 친구 친구만 친구만나러 가는중 카톡 카톡 카톡은 갑자기 급 맛감 tagcry ,20대 퇴근 퇴근했으 바 친구 친구만 친구만나러 가는중 카톡 카톡 카톡은 급 맛감 tagcry 
navertalk,1.29498E+17,Thu Oct 27 19:02:50 KST 2011,mnette10,Seungwon4,@Seungwon4 @Hellokang_e 콜 ㅋㅋㅋ 버스타면 카톡날릴께! 선강이도 올수있음와! #hr20,콜 tagsmile 버스타면 카톡날릴 카톡날릴 카톡날릴께 tagexclamation 선강 선강이 선강이 선강이도 올수있음와 tagexclamation hr20 ,콜 tagsmile 버스타면 카톡날릴 카톡날릴 카톡날릴께 tagexclamation 선강 선강이 선강이 선강이도 올수있음와 tagexclamation hr20 
navertalk,1.29498E+17,Thu Oct 27 19:02:32 KST 2011,totjw,SRyoung2,@SRyoung2 글이라고는 트위터랑 카톡보는데.... 그래서 제 눈이... 이러곸ㅋㅋㅋㅋㅋㅋ,글 트위터 트위터 트위터랑 카톡보는데 그래서 제 눈 누 이러곸 tagsmile ,글 트위터 트위터 트위터랑 카톡보는데 제 눈 누 이러곸 tagsmile 
navertalk,1.29498E+17,Thu Oct 27 19:02:25 KST 2011,Marbas_,null,말리지마 지금 카톡하는 중딩한테 고백해버릴거야,말리지마 지금 카톡 카톡 카톡하 카톡 카톡하 카톡하는 중딩한테 고백해버릴거 ,말리지마 지금 카톡 카톡 카톡하 카톡 카톡하 카톡하는 중딩한테 고백해버릴거 
navertalk,1.29498E+17,Thu Oct 27 19:01:50 KST 2011,MiNHeE_87,Ra2_Lee,야호? QT @Ra2_Lee: #20대 야호 카톡 안된다~ ^-^) ..... 왜이러지...,야호 tagquestion qt 20대 야호 카톡 안 왜이러지 ,야호 tagquestion qt 20대 야호 카톡 안 왜이러지 
navertalk,1.29498E+17,Thu Oct 27 19:01:48 KST 2011,kkminsunys,baddoll_com,@baddoll_com 마이베이비 도연 더이상안되 그다음은 카톡으로......^^,마이베이비 도연 더이상안되 그다음 그다음 그다음은 카톡 카톡으 tagsmile ,마이베이비 도연 더이상안되 그다음 그다음 그다음은 카톡 카톡으 tagsmile 
navertalk,1.29498E+17,Thu Oct 27 19:01:27 KST 2011,Realyuridayo,hj3104,@hj3104 카톡만듬＼(^o^)／haneechan,카톡만듬 o haneechan ,카톡만듬 o haneechan 
navertalk,1.29498E+17,Thu Oct 27 19:01:17 KST 2011,Varietysoul,1071394967,@01071394967 아하 그렇군요 카톡 잘못 봤나봐요 퇴근 하셨어요??,아하 그렇 카톡 잘못 봤나봐요 퇴근 하 하 tagquestion ,아하 그렇 카톡 잘못 봤나봐요 퇴근 하 하 tagquestion 
navertalk,1.29498E+17,Thu Oct 27 19:01:10 KST 2011,Ra2_Lee,seulmint,@seulmint 퇴군했엉~ 근데 타이밍좋게 카톡이 안되서 확인중 ㅠㅠ #20대,퇴군했엉 근데 타이밍좋게 카톡 카톡 카톡이 안되서 확인중 tagcry 20대 ,퇴군했엉 근데 타이밍좋게 카톡 카톡 카톡이 안되서 확인중 tagcry 20대 
navertalk,1.29498E+17,Thu Oct 27 19:00:59 KST 2011,8chR,null,자꾸 얼마전부터 이상하게 와이파이 연결되도 신호가 없다하고 ㅠ 3g 속도도 엄청 느려졌다고 느껴질때가 있는데.. 통신사 문제일까요 폰문제일까요 ㅜ 카톡도 자꾸 몰아서 오고 ㅜ 이건 카톡문제인가 ㅠ,자꾸 얼마전 이상 와이파 와이파 와이파이 연결되 연결되 연결되도 신호 없 tagcry 3g 속도 속 엄청 느리 느껴질때 느껴질때 느껴질때가 있 통신사 문제 폰문제 폰문제 폰문제일까 폰문제 폰문제일까 폰문제일까요 tagcry 카톡 카톡 카톡도 자꾸 몰 오 오 tagcry 이건 카톡문제인가 tagcry ,자꾸 얼마전 이상 와이파 와이파 와이파이 연결되 연결되 연결되도 신호 없 tagcry 3g 속도 속 엄청 느리 느껴질때 느껴질때 느껴질때가 있 통신사 문제 폰문제 폰문제 폰문제일까 폰문제 폰문제일까 폰문제일까요 tagcry 카톡 카톡 카톡도 자꾸 몰 오 오 tagcry 이건 카톡문제인가 tagcry 
navertalk,1.29498E+17,Thu Oct 27 19:00:50 KST 2011,woongppadope,minhye506,@minhye506 #95FM 카톡 아니디를 공개 하다니;;;;;,95fm 카톡 아니 아니디 아니디를 공개 하 하 ,95fm 카톡 아니 아니디 아니디를 공개 하 하 
navertalk,1.29498E+17,Thu Oct 27 19:00:47 KST 2011,Nabiwahighhill,null,2030이 박원순을 지지하고 나경원을 떨어트린 이유는 정책이 아니라 카카오톡 대화보면 “빌딩팔아 13억원 이익본것과 1억 피부미용”이다.딴건 모르겠다.,2030 2030 2030이 박원순 박원순 박원순을 지지 지 나경원 나경원 나경원을 떨어트리 이유 정책 아니 아 아니 아 카카오톡 대화보면 빌딩팔 빌딩팔 빌딩팔아 13억원 이익본것 1억 피부미용 이 딴건 모르 ,2030 2030 2030이 박원순 박원순 박원순을 지지 지 나경원 나경원 나경원을 떨어트리 이유 정책 아니 아 아니 아 카카오톡 대화보면 빌딩팔 빌딩팔 빌딩팔아 13억원 이익본것 1억 피부미용 이 딴건 모르 
navertalk,1.29498E+17,Thu Oct 27 19:00:16 KST 2011,ASQUme,null,오늘의톡)◐여고생들의 19금 카톡내용...(사진有)◐ 네이트판이니 음슴체 쓰겟음 ㅋ ㅋ 나는 대한민국 평균 흔녀 19살 고딩임 집에서 친구들이랑 카톡으로 그… http://t.co/AL61UOfn,오늘의톡 여고생 19금 카톡내용 사진 사 사 사 有 네이트판 네이트판 네이트판이 음슴체 쓰겟음 tagsmile tagsmile 나 나 나 나 대한민국 평균 흔녀 19살 고딩 고딩 고딩임 집 친구 카톡 카톡으 그 ,오늘의톡 여고생 19금 카톡내용 사진 사 사 사 有 네이트판 네이트판 네이트판이 음슴체 쓰겟음 tagsmile tagsmile 나 나 나 나 대한민국 평균 흔녀 19살 고딩 고딩 고딩임 집 친구 카톡 카톡으 
navertalk,1.29498E+17,Thu Oct 27 19:00:14 KST 2011,joker971120__,null,탐라리밋이다ㅠ할말틱톡ㅠ카톡알람안울림,탐라리밋 탐라리밋 탐라리밋이 tagcry 할말틱톡 tagcry 카톡알람안울림 ,탐라리밋 탐라리밋 탐라리밋이 tagcry 할말틱톡 tagcry 카톡알람안울림 
navertalk,1.29498E+17,Thu Oct 27 19:00:13 KST 2011,chriwitter,null,엄니 생신 아들노릇. 어머니 갤투 사드리기!! 회식이라 회사 앞서 개통하고 집에가서 손에만 쥐어드리고 다시 회사로 백ㅠ 그래도 내가 뭔가를 할 수 있어 기분이 너무 좋다. 이제 아버지한테 시도 때도 없이 카톡을 날리시는 날이 오겠지!!헤헷.,엄니 생신 아들노릇 어머니 갤투 사 사 tagexclamation 회식 회사 앞서 앞서 앞서 앞서 개통 집에가서 손 소 솔 쥐 쥐어드리 쥐어 쥐어드리 쥐어드리고 다시 회사 백 tagcry 그래 내 내 뭔가 뭔가 뭔가를 할 하 하 하 수 있 기분 너무 좋 이제 아버지한테 시도 시 시 때 없 카톡 카톡 카톡을 날 날 나 날 나 오 tagexclamation 헤헷 ,엄니 생신 아들노릇 어머니 갤투 사 사 tagexclamation 회식 회사 앞서 앞서 개통 집에가서 손 소 솔 쥐 쥐어드리 쥐어 쥐어드리 쥐어드리고 회사 백 tagcry 내 내 뭔가 뭔가 뭔가를 할 하 하 하 수 있 기분 좋 이제 아버지한테 시도 시 시 때 없 카톡 카톡 카톡을 날 날 나 날 나 오 tagexclamation 헤헷 
navertalk,1.29498E+17,Thu Oct 27 19:00:10 KST 2011,ASQUme,null,오늘의톡)어쩌다마주친 카톡남ㅋㅋㅋㅋ 여러분 안뇽ㅋㅋㅋㅋㅋㅋ(반말로할꼐요!!ㅎ) 난 항상 보기만하구 글은 처음쓰는데 서툴러도 이해해좈ㅋㅋㅋㅋ 3 어… http://t.co/zNin4Zy6,오늘의톡 어쩌다마주친 카톡 카톡 카톡남 tagsmile 여러분 안뇽 tagsmile 반말로할꼐 tagexclamation tagsmile 난 나 날 나 나 날 나 항상 보기만하구 글 처음쓰는데 서투르 이해해좈 tagsmile 3 어 ,오늘의톡 어쩌다마주친 카톡 카톡 카톡남 tagsmile 여러분 안뇽 tagsmile 반말로할꼐 tagexclamation tagsmile 난 나 날 나 나 날 나 보기만하구 글 처음쓰는데 서투르 이해해좈 tagsmile 3 어 
navertalk,1.29498E+17,Thu Oct 27 19:00:09 KST 2011,ASQUme,null,오늘의톡)카카오톡 친구추천 조심하세요 톡됬네요!!!.. 많은분들이 이 글을 보셔서 당하지 않으셨으면 좋겠어요 다시한번 말씀드리지만 이건 제가 있었던일… http://t.co/FkWyP2nd,오늘의톡 카카오톡 친구추천 조심 조 톡됬네 톡됬네 톡됬네요 tagexclamation 많은분 많은분 많은분들이 이 글 보셔서 당 않으셨으면 좋 다시한번 말씀 이건 제가 제 제 있 ,오늘의톡 카카오톡 친구추천 조심 조 톡됬네 톡됬네 톡됬네요 tagexclamation 많은분 많은분 많은분들이 이 글 보셔서 당 않으셨으면 좋 다시한번 말씀 이건 제가 제 제 있 
navertalk,1.29497E+17,Thu Oct 27 18:59:41 KST 2011,dlydfn,null,번호 바꼈어요 무슨 서비스?그거 안해놔서 예전번호로 연락해도 바뀐 번호로 안와요 카톡틱톡 보내주세요. 스마트폰 아닌 사람은 멘션주시면  문자?아님 트윗 메세진가 그거 보내드릴께요,번호 바꼈어요 무슨 서비스 tagquestion 그거 안해놔서 예전번호 연락 바뀌 번호 안와 안와 안와요 카톡틱톡 보 스마트폰 아니 아 사람 사 멘션주시면 문자 tagquestion 아니 아 트윗 메세진가 그거 보내 보내 보내드릴 보내 보내드릴께 보내드릴께요 ,번호 바꼈어요 무슨 서비스 tagquestion 그거 안해놔서 예전번호 연락 바뀌 번호 안와 안와 안와요 카톡틱톡 보 스마트폰 아니 아 사람 사 멘션주시면 문자 tagquestion 아니 아 트윗 메세진가 그거 보내 보내 보내드릴 보내 보내드릴께 보내드릴께요 
navertalk,1.29497E+17,Thu Oct 27 18:59:29 KST 2011,B1A40423,YUJIN980811,@YUJIN980811 유진아!!카톡중이가!,유진 tagexclamation 카톡중 카톡중이 카톡중이 카톡중이가 tagexclamation ,유진 tagexclamation 카톡중 카톡중이 카톡중이 카톡중이가 tagexclamation 
navertalk,1.29497E+17,Thu Oct 27 18:59:14 KST 2011,songtel,null,카카오톡 대화로 본 ‘2030의 반란’ http://t.co/9ddfuJti 이들이 박원순 후보에게 압도적으로 지지를 보낸 이유는 뭘까. 투표 당일 이들의 카카오톡 대화를 통해 가감없는 속얘기를 들어보자. 그리고 동영상을 보니..고개가 끄떡여진다.,카카오톡 대화 본 보 보 2030 2030 2030의 반란 이들 이들 이들이 박원순 후보 압도적 지 지지르 지지 지 보내 이유 뭘까 투표 당일 당 당 이들 이들 이들의 카카오톡 대화 통하 가감 속얘기 속얘기 속얘기를 들어보 그리고 그리 그리 동영 동영 동영상을 보 보 고개 끄떡 ,카카오톡 대화 본 보 보 2030 2030 2030의 반란 이들 이들 이들이 박원순 후보 압도적 지 지지르 지지 지 보내 이유 뭘까 투표 당일 당 당 이들 이들 이들의 카카오톡 대화 통하 가감 속얘기 속얘기 속얘기를 들어보 그리 그리 동영 동영 동영상을 보 보 고개 끄떡 
navertalk,1.29497E+17,Thu Oct 27 18:59:11 KST 2011,chococho89,lllrh0o0,@lllrh0o0 ㅋㅋㅋㅋ기히도 똑같이 너무 복사해서 줬다 ㅋㅋㅋㅋㅋ카톡화면꾹눌러서 텍스트복사해서 너무 붙여넣기했다,tagsmile 기 기히 기히도 똑같 너무 복사 주 tagsmile 카톡화면꾹눌러서 텍스트복사해서 텍스트복사 텍스트복사 너무 붙여넣기 ,tagsmile 기 기히 기히도 똑같 복사 주 tagsmile 카톡화면꾹눌러서 텍스트복사해서 텍스트복사 텍스트복사 붙여넣기 
navertalk,1.29497E+17,Thu Oct 27 18:59:09 KST 2011,Ra2_Lee,null,#20대 야호 카톡 안된다~ ^-^) ..... 왜이러지...,20대 야호 카톡 안 왜이러지 ,20대 야호 카톡 안 왜이러지 
navertalk,1.29497E+17,Thu Oct 27 18:58:47 KST 2011,happy_tia,null,잠깨겠다고 트윗+카톡을 미친듯이 했더니 건전지가 반토막 ㅜㅜ.... 아 ... 생명선(케이블)이 시급.....,잠깨 트윗 카톡 카톡 카톡을 미친듯 미친듯 미친듯이 하 하 건전지 반토막 tagcry 아 생명선 케이블 이 시급 ,잠깨 트윗 카톡 카톡 카톡을 미친듯 미친듯 미친듯이 하 하 건전지 반토막 tagcry 아 생명선 케이블 이 시급 
navertalk,1.29497E+17,Thu Oct 27 18:58:46 KST 2011,chococho89,giheeee,@giheeee ㅋㅋ감샤 ㅋㅋㅋ긍데 이미 바꾼다고 조교한테 냈자나 우리 ㅋㅋㅋ낸사람도 따로 카톡하는거야?ㅋㅋㅋ,tagsmile 감샤 tagsmile 긍데 이미 바꾸 조교한테 내 우리 tagsmile 낸사람 낸사람 낸사람도 따 따 따로 카톡하는거 카톡하는거 카톡하는거야 tagquestion tagsmile ,tagsmile 감샤 tagsmile 긍데 이미 바꾸 조교한테 내 우리 tagsmile 낸사람 낸사람 낸사람도 따 따 따로 카톡하는거 카톡하는거 카톡하는거야 tagquestion tagsmile 
navertalk,1.29497E+17,Thu Oct 27 18:58:39 KST 2011,namhee95,null,아이폰 고장남ㅜㅜㅜㅜ 카톡못해에에엥ㅠㅜ연락은 트위터에서,아이폰 고장 tagcry 카톡못해에에엥 tagcry tagcry 연락 트위터 ,아이폰 고장 tagcry 카톡못해에에엥 tagcry tagcry 연락 트위터 
navertalk,1.29497E+17,Thu Oct 27 18:58:31 KST 2011,_KKamo,onchmem,@onchmem 근데 옴니아라서 카톡을 못쓴다는게 함정<<,근데 옴니아 카톡 카톡 카톡을 못쓴다는게 함정 ,근데 옴니아 카톡 카톡 카톡을 못쓴다는게 함정 
navertalk,1.29497E+17,Thu Oct 27 18:58:23 KST 2011,eun_hyuk0404,shp13_sj,@shp13_sj 카톡 프사 영누싸인해놨었는데 어 오셨었어요?로시작해서 ㅋㅋㅋㅋㅋㅋㅋㅋㅋㅋㅋㅋㅋ이언니는 자주가서 영누가 알아본대,카톡 프사 영누싸인해놨었는데 어 오 tagquestion 로시작 로시작 로시작해서 tagsmile 이언니 이언니 이언니는 자주가서 영누 영누 영누가 알아보 ,카톡 프사 영누싸인해놨었는데 어 오 tagquestion 로시작 로시작 로시작해서 tagsmile 이언니 이언니 이언니는 자주가서 영누 영누 영누가 알아보 
navertalk,1.29497E+17,Thu Oct 27 18:58:23 KST 2011,Mooniva73,_flaringDD,@_flaringDD 소라씌! 혹시 폰번호 바뀌었어? 나 물어볼 거 있어서 카톡으로 날리려고 했는데..,소라씌 tagexclamation 혹시 폰번호 바뀌 tagquestion 나 나 나 나 물어보 거 거 거 거 있 카톡 카톡으 날 하 하 ,소라씌 tagexclamation 폰번호 바뀌 tagquestion 나 나 나 나 물어보 거 거 거 거 있 카톡 카톡으 날 하 하 
navertalk,1.29497E+17,Thu Oct 27 18:58:21 KST 2011,noonhs,azurity_,@azurity_ 나 은시리랑 같이잇어ㅋㅋㅋㅋㅋㅋ 뭐야진짜 아웃겨 사진그만보내 카톡자꾸오류나자나ㅜ_ㅜ_ㅜ_ㅜ_ㅜ 애인님이랑잇어?? 전화하면안돼??한번만대답해줭......학원은 왜안감??,나 나 나 나 은시리 은시리 은시리랑 같이잇어 tagsmile 뭐야진짜 아웃겨 사진그만보 카톡자꾸오류 tagcry tagcry tagcry tagcry tagcry 애인님이랑잇어 tagquestion 전화하면안 tagquestion 한번만대답해줭 학원 왜안감 tagquestion ,나 나 나 나 은시리 은시리 은시리랑 같이잇어 tagsmile 뭐야진짜 아웃겨 사진그만보 카톡자꾸오류 tagcry tagcry tagcry tagcry tagcry 애인님이랑잇어 tagquestion 전화하면안 tagquestion 한번만대답해줭 학원 왜안감 tagquestion 
