object_id,tweet_id,created_at,from_user,to_user,tweet_text,filtered_text,core_text
navertalk,1.29508E+17,Thu Oct 27 19:41:52 KST 2011,chzhdkdltm13,null,RT @86_eunhae: 카카오톡 슈퍼주니어 http://t.co/LuhNOXBX http://t.co/kWBejlVd http://t.co/1oAEObIO http://t.co/AGTuNJ3O http://t.co/q5nYNDI8,카카오톡 슈퍼주니어 ,카카오톡 슈퍼주니어 
navertalk,1.29508E+17,Thu Oct 27 19:41:48 KST 2011,2joongi,sey0love,@sey0love 호롤롤~ 며칠만 참어 그래서 카톡 못했구나 토닥토닥 ㅜ0ㅜ,호롤롤 며칠 참 차 그래서 카톡 못하 못했구 토닥토닥 tagcry 0 tagcry ,호롤롤 며칠 참 차 카톡 못하 못했구 토닥토닥 tagcry 0 tagcry 
navertalk,1.29508E+17,Thu Oct 27 19:41:33 KST 2011,PD_DHNS,godnewpower,@godnewpower ㅋㅋㅋ너랑카톡 하고싶다,tagsmile 너랑카톡 하고싶다 ,tagsmile 너랑카톡 하고싶다 
navertalk,1.29508E+17,Thu Oct 27 19:41:31 KST 2011,Rosinca_sativa,null,요 근래 교통수단에서 졸다 일어나 핸드폰을보면 꼭 1분전에 카톡이 와있긔...나 무음모드로 해 놓을텐데..?....(),요 근래 교통수단 졸 조 일어나 일어 일어 핸드폰을보면 꼭 1분전 1분전 1분전에 카톡 카톡 카톡이 와있긔 나 나 나 나 무음모드 해 하 하 하 놓을텐데 tagquestion ,요 근래 교통수단 졸 조 일어나 일어 일어 핸드폰을보면 1분전 1분전 1분전에 카톡 카톡 카톡이 와있긔 나 나 나 나 무음모드 해 하 하 하 놓을텐데 tagquestion 
navertalk,1.29508E+17,Thu Oct 27 19:41:08 KST 2011,kking1219,Ahreuming,@Ahreuming @ducheek 동우니가 나랑만 카톡하고싶대...먄...,동우 동우니 동우니 동우니가 나 나랑 나랑만 카톡하고싶대 먄 ,동우 동우니 동우니 동우니가 나 나랑 나랑만 카톡하고싶대 먄 
navertalk,1.29508E+17,Thu Oct 27 19:40:57 KST 2011,iruu86,cjpomme,@cjpomme 카톡하다가 심심하니 트윗도 하시는 구만..ㅋㅋ,카톡 카톡 카톡하 카톡 카톡하 카톡하다 심심 트윗 트윗 트윗도 하시 구 tagsmile ,카톡 카톡 카톡하 카톡 카톡하 카톡하다 심심 트윗 트윗 트윗도 하시 구 tagsmile 
navertalk,1.29508E+17,Thu Oct 27 19:40:46 KST 2011,hardboiled00,ShinNR,@ShinNR 나두 빨리 딸이랑 카톡하구 싶다.,나두 빨 딸 따 카톡하구 싶 ,나두 빨 딸 따 카톡하구 싶 
navertalk,1.29508E+17,Thu Oct 27 19:40:37 KST 2011,asda1517,lcl920,@lcl920 중요한건 카톡도 저모양저꼴.. 것도 지인과 동명이인인 애가 두어명 있음..,중요한건 카톡 카톡 카톡도 저모양저꼴 것 지인 지 동명이인인 동명이인 동명이인 동명이 애가 애 애 앗 두어명 있 ,중요한건 카톡 카톡 카톡도 저모양저꼴 것 지인 지 동명이인인 동명이인 동명이인 동명이 애가 애 애 앗 두어명 있 
navertalk,1.29508E+17,Thu Oct 27 19:40:33 KST 2011,ladidadihaha,null,엠카에 친구나와서 오랜만에 카톡 반갑당 친구야 흑흑ㅜㅜㅜㅜㅜㅜ그 가수 활동 언제 끝나니....ㅜㅜㅜㅋㅋㅋㅋㅋㅋㅋㅋㅋㅋㅋ,엠카 엠카 엠카에 친구 오랜만 카톡 반갑당 친구 흑흑 tagcry 그 가수 활동 언제 끝나 tagcry tagsmile ,엠카 엠카 엠카에 친구 카톡 반갑당 친구 흑흑 tagcry 가수 활동 언제 끝나 tagcry tagsmile 
navertalk,1.29508E+17,Thu Oct 27 19:40:32 KST 2011,hardensnume,null,카톡 문의를 카톡상으로는 안받나여?? 홈페이지에서만 받나요??,카톡 문의 문 카톡 카톡상으 카톡 카톡상으 안받 안받 안받나 안받나여 tagquestion 홈페이지 홈페 받 받 tagquestion ,카톡 문의 문 카톡 카톡상으 카톡 카톡상으 안받 안받 안받나 안받나여 tagquestion 홈페이지 홈페 받 받 tagquestion 
navertalk,1.29508E+17,Thu Oct 27 19:40:24 KST 2011,S_Min0101,null,슈주카톡 카톡왓숑!♥,슈주카톡 카톡왓숑 tagexclamation taglove ,슈주카톡 카톡왓숑 tagexclamation taglove 
navertalk,1.29508E+17,Thu Oct 27 19:40:20 KST 2011,yaejin92,SpecialJI,@SpecialJI 아닝파라과이 ~~  아아 카톡은잇는데... 그것도다운받아봐야겟네 ㅋ,아닝파라과 아닝파라과 아닝파라과이 앗 카톡은잇는데 그것도다운받아봐야겟네 tagsmile ,아닝파라과 아닝파라과 아닝파라과이 앗 카톡은잇는데 그것도다운받아봐야겟네 tagsmile 
navertalk,1.29508E+17,Thu Oct 27 19:40:14 KST 2011,seulhoon,newjingjing,@newjingjing ㅋㅋㅋㅋ 카톡에서 고고!,tagsmile 카톡 고고 고 고 tagexclamation ,tagsmile 카톡 고고 고 고 tagexclamation 
navertalk,1.29508E+17,Thu Oct 27 19:39:58 KST 2011,1077244804,null,아진짜;;;선혁아ㅜ왜전화안받아 학교도안오고 계속연락안되면진짜쌩이야ㅜ 최석주랑은카톡햇다며  아까트윗하나올린거보고바로연락햇는데 또안받아,아진짜 선혁 선혁 선혁아 tagcry 왜전화안 왜전화안받 왜전화안 왜전화안받 왜전화안받아 학교도안오 계속연락안되면진짜쌩 tagcry 최석주랑은카톡햇다 아까트윗하나올린거보고바로연락햇는데 또안 또안받 또안 또안받 또안받아 ,아진짜 선혁 선혁 선혁아 tagcry 왜전화안 왜전화안받 왜전화안 왜전화안받 왜전화안받아 학교도안오 계속연락안되면진짜쌩 tagcry 최석주랑은카톡햇다 아까트윗하나올린거보고바로연락햇는데 또안 또안받 또안 또안받 또안받아 
navertalk,1.29508E+17,Thu Oct 27 19:39:50 KST 2011,Leeyujoo90,null,아라언니에게 카톡와서 언니가 나 보고싶어 하는거 같아서 보고싶다구도 안하구 '유주야'라고 불르셧는데 내 대답은 동영상이었다!언니에게 인사 동영상을 보냈다... ㅋㅋㅋㅋㅋ 맥북 열은김에 인증샷 !!!뿌잉뿌잉 http://t.co/M9D26PGc,아라언니 카톡와서 언니 나 나 나 나 보고싶어 하는거 같 보고싶다구 안하구 유주 라 라 라고 불르셧는데 내 내 내 내 대답 동영 tagexclamation 언니 인사 동영 동영 동영상을 보내 tagsmile 맥북 열은김 열은김 열은김에 인증샷 tagexclamation 뿌잉뿌잉 ,아라언니 카톡와서 언니 나 나 나 나 보고싶어 하는거 같 보고싶다구 안하구 유주 라 라 라고 불르셧는데 내 내 내 내 대답 동영 tagexclamation 언니 인사 동영 동영 동영상을 보내 tagsmile 맥북 열은김 열은김 열은김에 인증샷 tagexclamation 뿌잉뿌잉 
navertalk,1.29508E+17,Thu Oct 27 19:39:47 KST 2011,JB0501,belletoujours,@belletoujours ㅋㅋㅋ 카톡은안하고 왜 트윗질이야,tagsmile 카톡은안 카톡은안 카톡은안하 왜 외 외 트윗질 트윗질 트윗질이 ,tagsmile 카톡은안 카톡은안 카톡은안하 왜 외 외 트윗질 트윗질 트윗질이 
navertalk,1.29508E+17,Thu Oct 27 19:39:44 KST 2011,M13SJinJu,null,"RT @MiDal_SJ13: 오오!!! ""@damngirlz_19: ★Super junior shake! 안드로이드버젼도 곧나온데요!!!>< (슈주카톡에서..ㅋㅋ)""",오 tagexclamation super junior shake tagexclamation 안드로이드버젼 안드로이드버젼 안드로이드버젼도 곧나온데 곧나온데 곧나온데요 tagexclamation 슈주카톡 tagsmile ,오 tagexclamation super junior shake tagexclamation 안드로이드버젼 안드로이드버젼 안드로이드버젼도 곧나온데 곧나온데 곧나온데요 tagexclamation 슈주카톡 tagsmile 
navertalk,1.29507E+17,Thu Oct 27 19:39:26 KST 2011,holic515,minhye506,@minhye506 카톡?ㅋ,카톡 tagquestion tagsmile ,카톡 tagquestion tagsmile 
navertalk,1.29507E+17,Thu Oct 27 19:39:11 KST 2011,ghkdnjs1106,null,RT @86_eunhae: 카카오톡 슈퍼주니어  http://t.co/VldRsiTc http://t.co/jbWkGIDn http://t.co/lZJAjoTs http://t.co/VHSZjrNH http://t.co/azPtkZsT,카카오톡 슈퍼주니어 ,카카오톡 슈퍼주니어 
navertalk,1.29507E+17,Thu Oct 27 19:38:58 KST 2011,SJcallNW,null,방금슈주카톡옴ㅋㅋㅋㅋㅋㅋㅋ다저장햇어13개사진다ㅋㅋㅋㅋ,방금슈주카톡옴 tagsmile 다저장햇어13 개사진다 tagsmile ,방금슈주카톡옴 tagsmile 다저장햇어13 개사진다 tagsmile 
navertalk,1.29507E+17,Thu Oct 27 19:38:48 KST 2011,forum301,null,하지마세요. 저는 가끔식 좋은말씀은 카톡으로 퍼 나르죠 ^^ RT @veinteanos20: '바이블' 봇을 팔로워 했더니... 몇 시간? 단위로 글이 올라 온다. 흘깃흘깃 볼때마다 내 마음이 '뜨금'... 언 팔로우 할까?...,하지마세 저 가끔식 좋은말씀 카톡 카톡으 퍼 나르죠 tagsmile 바이블 봇 봇 봇을 팔로워 하 하 몇 시간 tagquestion 단위 글 오 오르 오 흘깃흘깃 볼때 볼때마 내 내 내 내 마음 뜨금 얼 팔로우 하 하 tagquestion ,하지마세 저 가끔식 좋은말씀 카톡 카톡으 퍼 나르죠 tagsmile 바이블 봇 봇 봇을 팔로워 하 하 몇 시간 tagquestion 단위 글 오 오르 오 흘깃흘깃 볼때 볼때마 내 내 내 내 마음 뜨금 얼 팔로우 하 하 tagquestion 
navertalk,1.29507E+17,Thu Oct 27 19:38:46 KST 2011,z_ato,null,야 김소희ㅜㅜㅜㅜㅜ 나 니번호 저장안해서 카톡삭제하고 다시만들었는데 니가안떠말좀걸어봐,야 김소희 tagcry 나 나 나 나 니번호 저장안해서 카톡삭제 다시만들었는데 니가안떠말좀걸어봐 ,야 김소희 tagcry 나 나 나 나 니번호 저장안해서 카톡삭제 다시만들었는데 니가안떠말좀걸어봐 
navertalk,1.29507E+17,Thu Oct 27 19:38:41 KST 2011,streamer11,kkk_bbo,@kkk_bbo 016 724 2024 카톡 뿅!!,016 724 2024 카톡 뿅 tagexclamation ,016 724 2024 카톡 뿅 tagexclamation 
navertalk,1.29507E+17,Thu Oct 27 19:38:29 KST 2011,MiDal_SJ13,null,"오오!!! ""@damngirlz_19: ★Super junior shake! 안드로이드버젼도 곧나온데요!!!>< (슈주카톡에서..ㅋㅋ)""",오 tagexclamation super junior shake tagexclamation 안드로이드버젼 안드로이드버젼 안드로이드버젼도 곧나온데 곧나온데 곧나온데요 tagexclamation 슈주카톡 tagsmile ,오 tagexclamation super junior shake tagexclamation 안드로이드버젼 안드로이드버젼 안드로이드버젼도 곧나온데 곧나온데 곧나온데요 tagexclamation 슈주카톡 tagsmile 
navertalk,1.29507E+17,Thu Oct 27 19:38:25 KST 2011,Lovely_DW_b,helloimys__B_us,@helloimys__B_us 그러게요ㅋㅋ 카톡으로많이했죠^^,그러게 그러게 그러게요 tagsmile 카톡으로많이했죠 tagsmile ,그러게 그러게 그러게요 tagsmile 카톡으로많이했죠 tagsmile 
navertalk,1.29507E+17,Thu Oct 27 19:38:23 KST 2011,hardensnume,kakaoteam,@kakaoteam 님 문의를 카톡으로 드릴수는 없나여?? 카톡상으로 문의받는 분은 따로 안계신가요?,님 문의 문 카톡 카톡으 드릴수 없 없 tagquestion 카톡 카톡상으 문의 문 분 따 따 따로 안계신가 안계신가 안계신가요 tagquestion ,님 문의 문 카톡 카톡으 드릴수 없 없 tagquestion 카톡 카톡상으 문의 문 분 따 따 따로 안계신가 안계신가 안계신가요 tagquestion 
navertalk,1.29507E+17,Thu Oct 27 19:38:21 KST 2011,B2UTY961126,gold7820,@gold7820 학원 ㅜㅜ카톡못해잉ㅠㅠ,학원 tagcry 카톡못해잉 tagcry ,학원 tagcry 카톡못해잉 tagcry 
navertalk,1.29507E+17,Thu Oct 27 19:38:20 KST 2011,beeast0111,LimJeeen,@LimJeeen 나도...나도카톡카톡....나도트위터..할래....하고싶어...ㅜㅜㅜ,나도 나 나 나 나 나 나 나도카톡카톡 나도트위터 하 하 하고싶어 tagcry ,나도 나 나 나 나 나 나 나도카톡카톡 나도트위터 하 하 하고싶어 tagcry 
navertalk,1.29507E+17,Thu Oct 27 19:38:15 KST 2011,cnwls34,Kimilldae,@Kimilldae 아!저사진내카톡사진ㅋㅋ트윗사진도오빠로바꿀꺼야ㅋㅋ,아 tagexclamation 저사진내카톡사진 tagsmile 트윗사진도오빠로바꿀꺼 tagsmile ,아 tagexclamation 저사진내카톡사진 tagsmile 트윗사진도오빠로바꿀꺼 tagsmile 
navertalk,1.29507E+17,Thu Oct 27 19:38:11 KST 2011,reindeer56,Miss_Shin_0,@Miss_Shin_0 네톤 나 여기서 안들어가는데 거의 ㅜㅜㅜㅜㅜㅜㅜㅜㅜ 카톡은 어때?,네톤 나 나 나 나 여기서 안들어가는데 거의 거 거 거 tagcry 카톡 카톡 카톡은 어때 tagquestion ,네톤 나 나 나 나 여기서 안들어가는데 거의 거 거 거 tagcry 카톡 카톡 카톡은 어때 tagquestion 
navertalk,1.29507E+17,Thu Oct 27 19:38:09 KST 2011,26133771,null,ㅅㅂ 카톡카톡대지마 핸드폰없어서 할짓없는데 컴3시간쨰켜놧어 ㅋㅋㅋㅋㅋㅋㅋㅋㅋㅋRT @HM_0317: 진짜진짜심심해 대혁이랑 카톡중 ㅋㅋㅋㅋㅋㅋㅋㅋㅋㅋㅋ 할일이 음슴 ㅋㅋㅋㅋ ㅠㅠ,ㅅㅂ 카톡카톡대지마 핸드폰 할짓 컴3 시간쨰켜놧어 tagsmile 진짜진짜심심해 진짜진짜심심 진짜진짜심심 대혁 대혁 대혁이 카톡중 tagsmile 할 할일 할일이 음슴 tagsmile tagcry ,ㅅㅂ 카톡카톡대지마 핸드폰 할짓 컴3 시간쨰켜놧어 tagsmile 진짜진짜심심해 진짜진짜심심 진짜진짜심심 대혁 대혁 대혁이 카톡중 tagsmile 할 할일 할일이 음슴 tagsmile tagcry 
navertalk,1.29507E+17,Thu Oct 27 19:38:09 KST 2011,li1342,yoontwt,@yoontwt @ra0njena 난 그건모르겠네... 우선 불편한건 카톡 오스푸라검정화면 카메라롤이나 끌어내리면 뚝뚝끊기는거나 뭐 그런게 불편하네...,난 나 날 나 나 날 나 그건모르겠네 우선 불편한건 카톡 오스푸라검정화면 카메라롤 카메라롤 카메라롤이 끌어내 뚝뚝끊기는거 뭐 그런게 불편 ,난 나 날 나 나 날 나 그건모르겠네 우선 불편한건 카톡 오스푸라검정화면 카메라롤 카메라롤 카메라롤이 끌어내 뚝뚝끊기는거 뭐 그런게 불편 
navertalk,1.29507E+17,Thu Oct 27 19:38:05 KST 2011,kokoji_hye,null,보고있나?RT @yoorobingood: SM에서 카톡으로 보내주신 슈퍼주니어 사진들 보면 '펄 사파이어 블루 스틱봉' 돋네?^^ 이거 어떻게 설명할건데? http://t.co/C3OpNexB,보고 보 보 보고있 tagquestion sm 카톡 카톡으 보 슈퍼주니어 사 사 보 펄 사파이어 사파 사파 블루 스틱봉 돋 tagquestion tagsmile 이거 어떻 설명할건데 tagquestion ,보고 보 보 보고있 tagquestion sm 카톡 카톡으 보 슈퍼주니어 사 사 보 펄 사파이어 사파 사파 블루 스틱봉 돋 tagquestion tagsmile 이거 어떻 설명할건데 tagquestion 
navertalk,1.29507E+17,Thu Oct 27 19:38:02 KST 2011,JabCho1006,null,RT @hanitweet: 카카오톡에서 벌어지는 2030의 선거 이야기 들어 봅시다. 투표당일 가감없이 펼쳐진 그들의 이야기에 담긴 박원순과 나경원은? http://t.co/kEUW39qn,카카오톡 벌어지 2030 2030 2030의 선거 이야기 들 봅시 봅시 봅시다 투표당일 투표당 투표당 가감 펼쳐지 그들 이야기 담기 박원순 박원순 박원순과 나경원 나경원 나경원은 tagquestion ,카카오톡 벌어지 2030 2030 2030의 선거 이야기 들 봅시 봅시 봅시다 투표당일 투표당 투표당 가감 펼쳐지 그들 이야기 담기 박원순 박원순 박원순과 나경원 나경원 나경원은 tagquestion 
navertalk,1.29507E+17,Thu Oct 27 19:38:00 KST 2011,so_so_S,elf_Namju_u,@elf_Namju_u 언니하고선카톡주셔용♥,언니하고선카톡주셔용 taglove ,언니하고선카톡주셔용 taglove 
navertalk,1.29507E+17,Thu Oct 27 19:37:57 KST 2011,iam2darl,kimsol_s01,@kimsol_s01 ㅋㅋㅋㅋㅋㅋㅋㅋㅋ나는카톡이더빨랔ㅋㅋㅋㅋㅋㅋㅋㅋㅋㅋㅋㅋㅋ어플마니깔앗어??,tagsmile 나는카톡이더빨랔 tagsmile 어플마니깔앗어 tagquestion ,tagsmile 나는카톡이더빨랔 tagsmile 어플마니깔앗어 tagquestion 
navertalk,1.29507E+17,Thu Oct 27 19:37:47 KST 2011,DivineBirthACE,Golden_noir,@Golden_noir 아홉시쯤인가 졸면서 일교시 수업듣고 있는대 친구카톡으로 지금 북악관 앞에 한가인과 엄태웅이 있다는 소식이 뙇 잠이 확 깨더라그옄ㅋㅋㅋㅋㅋㅋㅋ,아홉시쯤 아홉시쯤 아홉시쯤인가 졸 조 일교시 수업듣고 있 친구카톡 지금 북악관 앞 한가 엄태웅 엄태웅 엄태웅이 있 소식 뙇 잠 자 확 깨더라그옄 tagsmile ,아홉시쯤 아홉시쯤 아홉시쯤인가 졸 조 일교시 수업듣고 있 친구카톡 지금 북악관 앞 한가 엄태웅 엄태웅 엄태웅이 있 소식 뙇 잠 자 확 깨더라그옄 tagsmile 
navertalk,1.29507E+17,Thu Oct 27 19:37:42 KST 2011,HM_0317,null,진짜진짜심심해 대혁이랑 카톡중 ㅋㅋㅋㅋㅋㅋㅋㅋㅋㅋㅋ 할일이 음슴 ㅋㅋㅋㅋ ㅠㅠ,진짜진짜심심해 진짜진짜심심 진짜진짜심심 대혁 대혁 대혁이 카톡중 tagsmile 할 할일 할일이 음슴 tagsmile tagcry ,진짜진짜심심해 진짜진짜심심 진짜진짜심심 대혁 대혁 대혁이 카톡중 tagsmile 할 할일 할일이 음슴 tagsmile tagcry 
navertalk,1.29507E+17,Thu Oct 27 19:37:35 KST 2011,SUPERMIRI13,null,오 카톡사진옴ㅋㅋㅋ,오 카톡사진옴 tagsmile ,오 카톡사진옴 tagsmile 
navertalk,1.29507E+17,Thu Oct 27 19:37:33 KST 2011,cutie_renee,mr_chosan,@mr_chosan 아흥ㅠㅠ 저는 카톡 재설치하니까 날아가고 없더라규용ㅠㅠ,아흥 tagcry 저 카톡 재설치 재설치 재설치하니까 날아가 없더라규용 tagcry ,아흥 tagcry 저 카톡 재설치 재설치 재설치하니까 날아가 없더라규용 tagcry 
navertalk,1.29507E+17,Thu Oct 27 19:37:20 KST 2011,kaotok,s_lee0917mzk,@s_lee0917mzk 좀 카톡보면 연락줭~♥,좀 조 조 카톡보면 연락줭 taglove ,좀 조 조 카톡보면 연락줭 taglove 
navertalk,1.29507E+17,Thu Oct 27 19:37:10 KST 2011,seoyic_eumma,null,오늘 친동생보다 더 친한 후배아들 생일이네. 카톡은 서로 연락하지 않아도 상태를 알수 있어서 좋다. 태어나자마자 아파서 부모 맘 아프게 한 녀석이니 앞으론 아프지 않고 잘지낼꺼라 믿는다.^^,오늘 친동생 친동생보 더 친하 후배아들 생일 생 카톡 카톡 카톡은 서로 서 서 서 연락 않 상태 알수 있 좋 태어나 아파서 부모 맘 아프 한 하 하 하 녀석 앞 아프 않 잘지낼꺼 잘지낼꺼 잘지낼꺼라 믿 tagsmile ,오늘 친동생 친동생보 친하 후배아들 생일 생 카톡 카톡 카톡은 서 서 서 연락 않 상태 알수 있 좋 태어나 아파서 부모 맘 아프 한 하 하 하 녀석 앞 아프 않 잘지낼꺼 잘지낼꺼 잘지낼꺼라 믿 tagsmile 
navertalk,1.29507E+17,Thu Oct 27 19:37:09 KST 2011,twinkle_kwon,Lostwing_0614,@Lostwing_0614 ㅠㅠ 카톡 가늣?,tagcry 카톡 가늣 tagquestion ,tagcry 카톡 가늣 tagquestion 
navertalk,1.29507E+17,Thu Oct 27 19:37:00 KST 2011,_880203_,aesi_hj,@aesi_hj 카톡 사진이용ㅋㅋ슈주카톡,카톡 사진이용 tagsmile 슈주카톡 ,카톡 사진이용 tagsmile 슈주카톡 
navertalk,1.29507E+17,Thu Oct 27 19:36:17 KST 2011,_880203_,null,슈주 카톡 사진ㅋㅋ 동해오빠 젤 많이 보는듯ㅋㅋㅋ 사진 찍어주시는 분이 동해오빠 짱팬이신가보다ㅋㅋㅋ,슈주 카톡 사진 사 사 사 tagsmile 동해오빠 젤 많 보는듯 tagsmile 사진 사 사 사 찍 분 동해오빠 짱팬 짱팬이신가 짱팬이신가보 tagsmile ,슈주 카톡 사진 사 사 사 tagsmile 동해오빠 젤 많 보는듯 tagsmile 사진 사 사 사 분 동해오빠 짱팬 짱팬이신가 짱팬이신가보 tagsmile 
navertalk,1.29507E+17,Thu Oct 27 19:36:17 KST 2011,Cherry940909,bomnaekr,@bomnaekr 내일단어시험 프린트좀 찍어서 카톡으로 보내주렴 ㅠㅠㅠㅠ,내일단어시험 프린트좀 찍 카톡 카톡으 보 tagcry ,내일단어시험 프린트좀 카톡 카톡으 보 tagcry 
navertalk,1.29507E+17,Thu Oct 27 19:36:14 KST 2011,youngyoungci,null,나도 머지않아 카톡으로 오빠들 사진을 받아볼수 있는 요자가 될꺼얌... 흑흑... 그게 언제일까...,나도 나 나 나 나 나 나 머지않 카톡 카톡으 오빠 사진 사 받아볼수 있 요자 요자 요자가 될꺼얌 흑흑 그게 언제 언제 언제일까 ,나도 나 나 나 나 나 나 머지않 카톡 카톡으 오빠 사진 사 받아볼수 있 요자 요자 요자가 될꺼얌 흑흑 그게 언제 언제 언제일까 
navertalk,1.29507E+17,Thu Oct 27 19:35:57 KST 2011,happy7570,seulmint,@seulmint #20대 축하축하!!ㅋㅋ아 카톡이이상한건가 3G가 이상한건가..ㅋㅋ이제 밥먹겟네 맛저녁해~ㅎㅎ,20대 축하축하 축하축 축하축 tagexclamation tagsmile 아 카톡이이상한건가 3g 3g 3g가 이상한건가 tagsmile 이제 밥먹겟네 맛저녁 맛저녁 맛저녁해 tagsmile ,20대 축하축하 축하축 축하축 tagexclamation tagsmile 아 카톡이이상한건가 3g 3g 3g가 이상한건가 tagsmile 이제 밥먹겟네 맛저녁 맛저녁 맛저녁해 tagsmile 
navertalk,1.29507E+17,Thu Oct 27 19:35:49 KST 2011,mini1106,null,카톡 슈주 사진 떴당,카톡 슈주 사진 사 사 사 떴당 ,카톡 슈주 사진 사 사 사 떴당 
navertalk,1.29507E+17,Thu Oct 27 19:35:46 KST 2011,Yaho_oh,null,"카톡 담당자가 동해를 좋아하나보다  다른 멤버들은 슈퍼주니어 은혁, 신동, 예성 이런데 동해는 '노래하는 멋진 동해'!!!! ㅋㅋ",카톡 담당자 동해 동 좋아하 좋아하 좋아하나보 다르 멤버 슈퍼주니어 은혁 신동 예성 이런데 동해 동 노래 노랗 멋지 동해 동 동 tagexclamation tagsmile ,카톡 담당자 동해 동 좋아하 좋아하 좋아하나보 다르 멤버 슈퍼주니어 은혁 신동 예성 이런데 동해 동 노래 노랗 멋지 동해 동 동 tagexclamation tagsmile 
navertalk,1.29507E+17,Thu Oct 27 19:35:36 KST 2011,Heehyun0614,jinbbong2,@jinbbong2 왜 카톡업뎃안해? 나 퇴근했다 지금간다?,왜 외 외 카톡업뎃안 카톡업뎃안 카톡업뎃안해 tagquestion 나 나 나 나 퇴근 지금간다 tagquestion ,왜 외 외 카톡업뎃안 카톡업뎃안 카톡업뎃안해 tagquestion 나 나 나 나 퇴근 지금간다 tagquestion 
navertalk,1.29507E+17,Thu Oct 27 19:35:33 KST 2011,SpecialJI,yaejin92,@yaejin92 카톡같은거 빨러 ㅋㅋㅋㅋ,카톡같은거 빨 빠르 tagsmile ,카톡같은거 빨 빠르 tagsmile 
navertalk,1.29507E+17,Thu Oct 27 19:35:31 KST 2011,li1342,yoontwt,@yoontwt @RA0NJENA iOS5가 나온지가언젠데 카톡은 최적화안하지?? 겁나미친광우프로젝트하느라그러나??? 터치안먹는건 없는거같은데 나는,ios5 ios5 ios5가 나온지가언젠데 카톡 카톡 카톡은 최적화안하지 tagquestion 겁나미친광우프로젝트하느라그러 tagquestion 터치안먹는건 없는거 나 나 나 나 ,ios5 ios5 ios5가 나온지가언젠데 카톡 카톡 카톡은 최적화안하지 tagquestion 겁나미친광우프로젝트하느라그러 tagquestion 터치안먹는건 없는거 나 나 나 나 
navertalk,1.29506E+17,Thu Oct 27 19:35:30 KST 2011,NewHeart1225,Pinwheel1004,@Pinwheel1004 @Yeongbin 그럼 되겄지머ㅋㅋㅋㅋㅋ 고칠때까지 카톡은 안녕이군,그럼 되겄지머 tagsmile 고칠때 카톡 카톡 카톡은 안녕 ,그럼 되겄지머 tagsmile 고칠때 카톡 카톡 카톡은 안녕 
navertalk,1.29506E+17,Thu Oct 27 19:35:29 KST 2011,J_mi2,null,14141414...ㅎㅓ허 2주뒤에 들어올께... 나보고시프면 카톡해용^~^흐흐 2주뒤에 들어오면 폭풍 반겨주기!! 그럼 이만 뿅♡,14141414 tagsmile ㅓ 허 2주뒤 2주뒤 2주뒤에 들어오 나보고시프면 카톡해용 흐흐 2주뒤 2주뒤 2주뒤에 들어오 폭풍 반겨주기 tagexclamation 그럼 이 뿅 taglove ,14141414 tagsmile ㅓ 허 2주뒤 2주뒤 2주뒤에 들어오 나보고시프면 카톡해용 2주뒤 2주뒤 2주뒤에 들어오 폭풍 반겨주기 tagexclamation 그럼 이 뿅 taglove 
navertalk,1.29506E+17,Thu Oct 27 19:35:04 KST 2011,skgus1012,null,카카오톡 플러스친구 샤이니 사진 http://t.co/eWAqt7SJ http://t.co/XCNx2fqQ,카카오톡 플러스친구 샤 샤 샤이 사진 사 사 사 ,카카오톡 플러스친구 샤 샤 샤이 사진 사 사 사 
navertalk,1.29506E+17,Thu Oct 27 19:34:54 KST 2011,yoorobingood,null,SM에서 카톡으로 보내주신 슈퍼주니어 사진들 보면 '펄 사파이어 블루 스틱봉' 돋네?^^ 이거 어떻게 설명할건데? http://t.co/pi4VaAJB,sm 카톡 카톡으 보 슈퍼주니어 사 사 보 펄 사파이어 사파 사파 블루 스틱봉 돋 tagquestion tagsmile 이거 어떻 설명할건데 tagquestion ,sm 카톡 카톡으 보 슈퍼주니어 사 사 보 펄 사파이어 사파 사파 블루 스틱봉 돋 tagquestion tagsmile 이거 어떻 설명할건데 tagquestion 
navertalk,1.29506E+17,Thu Oct 27 19:34:38 KST 2011,sylphbard,kimpange,@kimpange 응~뭔지모르게끙ㅎㅎ카톡문자좀 보내볼래잉,응 뭔지모르게끙 tagsmile 카톡문자좀 보내볼래잉 ,뭔지모르게끙 tagsmile 카톡문자좀 보내볼래잉 
navertalk,1.29506E+17,Thu Oct 27 19:34:32 KST 2011,860404hj,null,ㅋㅋㅋㅋㅋㅋㅋㅋㅋ 언니 감사옄ㅋㅋㅋㅋㅋㅋㅋㅋRT @yjs0730: 이단비년을위한나의넓은마음ㅋㅋ옛다방금슈퍼주니어친구에게온카톡이다 http://t.co/iZ0Wo7r2 http://t.co/o2zymOGF,tagsmile 언니 감사옄 tagsmile 이단비년을위한나의넓은마음 tagsmile 옛다방금슈퍼주니어친구에게온카톡 ,tagsmile 언니 감사옄 tagsmile 이단비년을위한나의넓은마음 tagsmile 옛다방금슈퍼주니어친구에게온카톡 
