object_id,tweet_id,created_at,from_user,to_user,tweet_text,filtered_text,core_text
navertalk,1.29513E+17,Thu Oct 27 20:00:01 KST 2011,ddaom,crocus_cat,@crocus_cat 카톡? 암것도 안왔어요!,카톡 tagquestion 암것 암것 암것도 안왔어 안왔어 안왔어요 tagexclamation ,카톡 tagquestion 암것 암것 암것도 안왔어 안왔어 안왔어요 tagexclamation 
navertalk,1.29513E+17,Thu Oct 27 19:59:38 KST 2011,Super0901,eunjiing,@eunjiing 야 카톡좀봐봐,야 카톡좀봐봐 ,야 카톡좀봐봐 
navertalk,1.29513E+17,Thu Oct 27 19:59:33 KST 2011,DCtamago_,bhckor,@bhckor 카카오톡 친구추가하면 천원쿠폰줌..,카카오톡 친구추가 천원쿠폰줌 ,카카오톡 친구추가 천원쿠폰줌 
navertalk,1.29513E+17,Thu Oct 27 19:59:26 KST 2011,xiahjoeun,Gunseotic,@Gunseotic 바보멍텅이카톡봐,바보멍텅이카톡봐 ,바보멍텅이카톡봐 
navertalk,1.29512E+17,Thu Oct 27 19:59:18 KST 2011,abidingyean,Superior_silver,@Superior_silver 아아아아아아글쿠나ㅋㅋㅋㅋ아 연락하구싶겠당 카톡알면!!,아아아아아아글쿠 아아아아아아글쿠 아아아아아아글쿠나 tagsmile 아 연락하구싶겠당 카톡알면 tagexclamation ,아아아아아아글쿠 아아아아아아글쿠 아아아아아아글쿠나 tagsmile 아 연락하구싶겠당 카톡알면 tagexclamation 
navertalk,1.29512E+17,Thu Oct 27 19:59:14 KST 2011,Ingyolss,null,나한테 카톡을 먼저 보내는사람은. .음.ㅎㅎㅎ음..ㅎㅎㅎㅎㅎㅎ 말안할래,나한테 카톡 카톡 카톡을 먼저 보내는사람 음 tagsmile 음 tagsmile 말안 말안 말안할래 ,나한테 카톡 카톡 카톡을 먼저 보내는사람 음 tagsmile 음 tagsmile 말안 말안 말안할래 
navertalk,1.29512E+17,Thu Oct 27 19:58:29 KST 2011,DCtamago_,bhckor,@bhckor 이벤끗남 그대신 카톡친추하면 처넌줌,이벤끗 이벤끗 이벤끗남 그대신 카톡친추 카톡친추 카톡친추하면 처넌줌 ,이벤끗 이벤끗 이벤끗남 그대신 카톡친추 카톡친추 카톡친추하면 처넌줌 
navertalk,1.29512E+17,Thu Oct 27 19:58:27 KST 2011,910208_wh,null,엠카뭐야 복오싶긩 흰피니트에 깐성열이람서여 흑 ㄱㅈㅇ집가서 다봐야지 근데 얘 ㅃㅃㄹ만든다고 카톡답안하긩^~^ 나 다와가는데.. 나 미아될기세얌,엠카뭐 엠카뭐 엠카뭐야 복오싶긩 흰피니트 깐성열이람서 깐성열이람서 깐성열이람서여 흑 ㄱㅈㅇ 집가서 다봐야지 근데 얘 ㅃㅃㄹ 말 카톡답안하긩 나 나 나 나 다와가는데 나 나 나 나 미아될기세얌 ,엠카뭐 엠카뭐 엠카뭐야 복오싶긩 흰피니트 깐성열이람서 깐성열이람서 깐성열이람서여 ㄱㅈㅇ 집가서 다봐야지 근데 얘 ㅃㅃㄹ 말 카톡답안하긩 나 나 나 나 다와가는데 나 나 나 나 미아될기세얌 
navertalk,1.29512E+17,Thu Oct 27 19:57:54 KST 2011,sjaqj17,null,그쵸 ㅎ 아~ 그리고 이건 개인적인 고민인되요 . 평소에 연락 안하던 친구가 갑자기 카톡이 와서 이런저런... http://t.co/6AfPF8Tx,그쵸 tagsmile 아 그리고 그리 그리 이건 개인적 고민 평소 연락 안하 친구 갑자기 카톡 카톡 카톡이 오 이런저런 ,그쵸 tagsmile 아 그리 그리 이건 개인적 고민 평소 연락 안하 친구 카톡 카톡 카톡이 오 이런저런 
navertalk,1.29512E+17,Thu Oct 27 19:57:50 KST 2011,y25nju,null,벜벜 카톡이나와따 왠지모르게 강유니를 위해 만든것만같은 이기분...왜지ㅋ?,벜벜 카톡이나와따 왠지모르게 강유 강유니 강유니 강유니를 위해 위하 위하 만든것 만든것만 만든것만같 만든것만 만든것만같 만든것만같은 이기분 왜지 tagsmile tagquestion ,벜벜 카톡이나와따 왠지모르게 강유 강유니 강유니 강유니를 위해 위하 위하 만든것 만든것만 만든것만같 만든것만 만든것만같 만든것만같은 이기분 왜지 tagsmile tagquestion 
navertalk,1.29512E+17,Thu Oct 27 19:57:45 KST 2011,R__summer,null,RT @seulhoon: 카톡에서 '플러스 친구' 다 스팸만 오는데 버거킹 이놈들은 쿠폰을 준다! 버거킹 넌 좋은 놈이었어..,카톡 플러스 친구 다 스팸만 오 버거킹 이놈 이놈 이놈들은 쿠폰 주 줄 주 tagexclamation 버거킹 넌 널 널 널 좋 놈 ,카톡 플러스 친구 다 스팸만 오 버거킹 이놈 이놈 이놈들은 쿠폰 주 줄 주 tagexclamation 버거킹 넌 널 널 널 좋 놈 
navertalk,1.29512E+17,Thu Oct 27 19:57:24 KST 2011,kanonj13,sunhyekim,@sunhyekim ㅋ시대에 뒤떨어진게 아니라?! 내만 사용하는 말이여?ㅋ난 트윗 아이디가 카톡 아이디^^,tagsmile 시대 뒤떨어진게 아니 아 아니 아 tagquestion tagexclamation 내 내 사용 말 말 말 말 tagquestion tagsmile 난 나 날 나 나 날 나 트윗 아 아이디 아이디가 카톡 아 tagsmile ,tagsmile 시대 뒤떨어진게 아니 아 아니 아 tagquestion tagexclamation 내 내 사용 말 말 말 말 tagquestion tagsmile 난 나 날 나 나 날 나 트윗 아 아이디 아이디가 카톡 아 tagsmile 
navertalk,1.29512E+17,Thu Oct 27 19:57:23 KST 2011,camellianism,MINYOUNGTIC,@MINYOUNGTIC 뭐가 2번인데?? 카톡 잘 하다가 무슨...,뭐 2번 2번 2번인데 tagquestion 카톡 잘 자 자 자 하 하 하 하 무슨 ,뭐 2번 2번 2번인데 tagquestion 카톡 잘 자 자 자 하 하 하 하 무슨 
navertalk,1.29512E+17,Thu Oct 27 19:57:18 KST 2011,Donald_ryeok,null,드디어 슈주카카오톡 ver.뉴욕 에 나타나신 려욱잌ㅋㅋㅋㅋㅋㅋㅋㅋㅋㅋㅋㅋㅋㅋㅋ머리가 인상적이닼ㅋㅋㅋ http://t.co/5txwhDD5,드디어 슈주카카오톡 ver 뉴욕 에 나타나 려욱잌 tagsmile 머리 인상적이닼 tagsmile ,드디어 슈주카카오톡 ver 뉴욕 나타나 려욱잌 tagsmile 머리 인상적이닼 tagsmile 
navertalk,1.29512E+17,Thu Oct 27 19:57:12 KST 2011,solist01,null,@_rendy90: 제일먼저 어떤 어플을 깔까? 트위터? 페이스북? 카톡/왓챕?뱅킹어플ㅋㅋㅋ,제일먼저 어떤 어플 어플 어플을 까 tagquestion 트위터 tagquestion 페이스북 tagquestion 카톡 왓챕 tagquestion 뱅킹어플 tagsmile ,제일먼저 어떤 어플 어플 어플을 까 tagquestion 트위터 tagquestion 페이스북 tagquestion 카톡 왓챕 tagquestion 뱅킹어플 tagsmile 
navertalk,1.29512E+17,Thu Oct 27 19:57:12 KST 2011,JsoYruJ,null,11월1일을 기점으로 휴트휴트 진짜 할 시점 이제막 친해진분들이랑 좀 아숩지만 ㅜ_ㅜ 뭐 금방 돌아올거니까영...ㅇㅇ틱톡이나 카톡 라인으로 연락 자주할게영~,11월1 일 기점 휴트휴트 진짜 할 하 하 하 시점 이제막 친해진분 친해진분 친해진분들이 좀 조 조 아숩지만 tagcry tagcry 뭐 금방 돌아올거니까영 ㅇㅇ 틱톡 틱톡 틱톡이 카톡 라인 라 연락 자주할게영 ,11월1 일 기점 휴트휴트 진짜 할 하 하 하 시점 이제막 친해진분 친해진분 친해진분들이 좀 조 조 아숩지만 tagcry tagcry 뭐 금방 돌아올거니까영 ㅇㅇ 틱톡 틱톡 틱톡이 카톡 라인 라 연락 자주할게영 
navertalk,1.29512E+17,Thu Oct 27 19:57:03 KST 2011,_azaza,kr_4NIA,@kr_4NIA 카카오톡하세요?,카카오톡 카카오톡 카카오톡하세 tagquestion ,카카오톡 카카오톡 카카오톡하세 tagquestion 
navertalk,1.29512E+17,Thu Oct 27 19:56:55 KST 2011,incheonhenhja,lo1357v,@lo1357v 저도 카카오톡은 설치하곤 잘안쓰고 무조건 전화로 ㅋㅋㅋㅋ 카톡한두마디 나누다가 그냥 통화버튼 누르고 ㅋㅋㅋㅋ,저 카카오톡 카카오톡 카카오톡은 설치 잘안쓰 잘안쓰 잘안쓰고 무조건 전화 tagsmile 카톡한두마디 나누 그냥 통화버튼 누르 tagsmile ,저 카카오톡 카카오톡 카카오톡은 설치 잘안쓰 잘안쓰 잘안쓰고 무조건 전화 tagsmile 카톡한두마디 나누 통화버튼 누르 tagsmile 
navertalk,1.29512E+17,Thu Oct 27 19:56:54 KST 2011,se_dj,jjungjjung_2,@jjungjjung_2 카톡만안할뿐이냐눙....ㅋㅋㅋㅋㅋ시발ㅋㅋㅋ생투 풀엇는데 19점ㅋㅋㅋㅋㅋㅋ나이과맞냨ㅋㅋㅋㅋ으악,카톡만안할뿐이냐눙 tagsmile 시발 tagsmile 생투 풀엇는데 19점 tagsmile 나이과맞냨 tagsmile 으악 ,카톡만안할뿐이냐눙 tagsmile 시발 tagsmile 생투 풀엇는데 19점 tagsmile 나이과맞냨 tagsmile 
navertalk,1.29512E+17,Thu Oct 27 19:56:48 KST 2011,bella221207,with_sojeong92,@with_sojeong92 내가 아끼는 소정이 언니! 오늘 엠카 볼때 카톡 보내줘서 고마워요~ ^^ 제가 하는일도 없는데 항상 챙겨주셔서 또 정말 고마워요! 언니 일 너무 무리하면 안되는거 알죠? 언니 건강 잘 챙겨야 되요!! 아니면 저 엄청 슬퍼요,내 내 아끼 소정 언니 tagexclamation 오늘 엠카 볼때 카톡 보 고맙 tagsmile 제가 제 제 하는 하는일 하는일 하는일도 없 항상 챙기 또 정말 고맙 tagexclamation 언니 일 너무 무리 안되는거 알죠 tagquestion 언니 건강 잘 자 자 자 챙기 되 되 tagexclamation 아니 아 저 엄청 슬프 슬퍼 슬프 ,내 내 아끼 소정 언니 tagexclamation 오늘 엠카 볼때 카톡 보 고맙 tagsmile 제가 제 제 하는 하는일 하는일 하는일도 없 챙기 또 고맙 tagexclamation 언니 일 무리 안되는거 알죠 tagquestion 언니 건강 잘 자 자 자 챙기 되 되 tagexclamation 아니 아 저 엄청 슬프 슬퍼 슬프 
navertalk,1.29512E+17,Thu Oct 27 19:56:01 KST 2011,Ingyolss,null,아하하^^ 카톡에 나한테 문자주는애는 버거킹뿐이다,아하 아하 아하하 tagsmile 카톡 카톡 카톡에 나한테 문자주는애 버거킹 버거킹 버거킹뿐이 ,아하 아하 아하하 tagsmile 카톡 카톡 카톡에 나한테 문자주는애 버거킹 버거킹 버거킹뿐이 
navertalk,1.29512E+17,Thu Oct 27 19:55:46 KST 2011,CUBE_HS_U,MBLAQSH_User,@MBLAQSH_User 카톡있어?,카톡 카톡 카톡있어 tagquestion ,카톡 카톡 카톡있어 tagquestion 
navertalk,1.29512E+17,Thu Oct 27 19:55:41 KST 2011,bum__k,4081004,@04081004 흡..한국에서두 빨리 해줬음 조케써ㅠㅠ..그나저나 오늘 쩡키 터지나부네ㅜㅠ!!카톡사진에이어서ㅜㅜ,흡 한국에서두 빨 하 하 조케써 tagcry 그나저 그나저 그나저나 오늘 쩡키 터지나부네 tagcry tagcry tagexclamation 카톡사진 카톡사진에 카톡사진에이어서 tagcry ,흡 한국에서두 빨 하 하 조케써 tagcry 그나저 그나저 그나저나 오늘 쩡키 터지나부네 tagcry tagcry tagexclamation 카톡사진 카톡사진에 카톡사진에이어서 tagcry 
navertalk,1.29512E+17,Thu Oct 27 19:55:34 KST 2011,Chicken1103,Yongrabbit_user,@Yongrabbit_user @FJH_u 아. .ㅠㅜㅜ어제봇동운이형한테카톡겁나빨리하시면되실텐데..그리고이제받고싶어도애칭도없고..카톡렉때매안될껄요ㅜㅜ,아 tagcry tagcry 어제봇동운이형한테카톡겁나빨리 그리고이제받고싶어도애칭 카톡렉때매안될껄 카톡렉때매안될껄 카톡렉때매안될껄요 tagcry ,아 tagcry tagcry 어제봇동운이형한테카톡겁나빨리 그리고이제받고싶어도애칭 카톡렉때매안될껄 카톡렉때매안될껄 카톡렉때매안될껄요 tagcry 
navertalk,1.29511E+17,Thu Oct 27 19:55:09 KST 2011,_Irinamu,_ENOZ,"@_ENOZ 페북은 너무 못나누는데, 구플은 좀 심하더군요. 정 말하자면 구플이 낫긴 하지만...전 구플은 영.....차라리 카톡을 하고 말죠.",페북 페북 페북은 너무 못나누는데 구플 구플 구플은 좀 조 조 심 시 정 말 말 구플 구플 구플이 낫 하지만 하 하지 하 하 하지 하 전 절 절 구플 구플 구플은 영 차라리 카톡 카톡 카톡을 하 하 하 하 말죠 ,페북 페북 페북은 못나누는데 구플 구플 구플은 좀 조 조 심 시 정 말 말 구플 구플 구플이 낫 하 하지 하 하 하지 하 전 절 절 구플 구플 구플은 영 카톡 카톡 카톡을 하 하 하 하 말죠 
navertalk,1.29511E+17,Thu Oct 27 19:55:02 KST 2011,jinah8616,maki113j,@maki113j 삿포로~알아~! !  가본적은 없지만~^ ^;; 카톡은 전에는 했는데 이제 안해~ㅠㅠ 트위터 시작하고~ ^ ^,삿포 삿포 삿포로 알 알 tagexclamation tagexclamation 가본적 가본적 가본적은 없 카톡 카톡 카톡은 전 절 하 하 이제 안하 tagcry 트위터 시작 ,삿포 삿포 삿포로 알 알 tagexclamation tagexclamation 가본적 가본적 가본적은 없 카톡 카톡 카톡은 전 절 하 하 이제 안하 tagcry 트위터 시작 
navertalk,1.29511E+17,Thu Oct 27 19:54:53 KST 2011,rakangs,ultrashawk,@ultrashawk  동한몬에게 물어볼거 있어서 카톡 4번에 국제전화까지 했는데 다 씹혔음... 아~ 우울하다,동한몬 물어볼거 있 카톡 4번 4번 4번에 국제전화 하 하 다 씹히 아 우울 ,동한몬 물어볼거 있 카톡 4번 4번 4번에 국제전화 하 하 다 씹히 아 우울 
navertalk,1.29511E+17,Thu Oct 27 19:54:31 KST 2011,eegirl01,null,왜 내카톡친추에 닭제이사장님이뜨는가...ㅋ,왜 외 외 내카톡친추 내카톡친추 내카톡친추에 닭제이사장님이뜨는가 tagsmile ,왜 외 외 내카톡친추 내카톡친추 내카톡친추에 닭제이사장님이뜨는가 tagsmile 
navertalk,1.29511E+17,Thu Oct 27 19:54:28 KST 2011,Rudbeckia_s,DCtamago_,@DCtamago_ 아 카톡에 또 버거킹 쿠폰왔다,아 카톡 카톡 카톡에 또 버거킹 쿠폰왔다 ,아 카톡 카톡 카톡에 또 버거킹 쿠폰왔다 
navertalk,1.29511E+17,Thu Oct 27 19:54:16 KST 2011,charisma_jo,ggom43,@ggom43 ㅋㅋㅋ랑카짱의 전화버번호도 있구나 ㅋㅋ 그럼 언니 카톡이 있어요?? ㅋㅋ,tagsmile 랑카짱 랑카짱 랑카짱의 전화버번호 있 있구 tagsmile 그럼 언니 카톡 카톡 카톡이 있 tagquestion tagsmile ,tagsmile 랑카짱 랑카짱 랑카짱의 전화버번호 있 있구 tagsmile 그럼 언니 카톡 카톡 카톡이 있 tagquestion tagsmile 
navertalk,1.29511E+17,Thu Oct 27 19:54:10 KST 2011,showme921204,eh0222,@eh0222 ㅋㅋㅋㅋㅋㅋㅋㅋ그거 나도 듣고 싶어 언니 카톡으로 못보내줘?ㅋㅋㅋㅋㅋㅋ,tagsmile 그거 나도 나 나 나 나 나 나 듣 싶어 싶 싶 언니 카톡 카톡으 못보내줘 tagquestion tagsmile ,tagsmile 그거 나도 나 나 나 나 나 나 듣 싶어 싶 싶 언니 카톡 카톡으 못보내줘 tagquestion tagsmile 
navertalk,1.29511E+17,Thu Oct 27 19:53:49 KST 2011,b__east__1016,null,종현승 오기만 해바ㅡㅡ카톡도 확인하구 답안하구..^^ 준호같네..,종현승 오 오기 오 해바 tagcry 카톡 카톡 카톡도 확인하구 답안하구 tagsmile 준호 준호 준호같네 ,종현승 오 오기 오 해바 tagcry 카톡 카톡 카톡도 확인하구 답안하구 tagsmile 준호 준호 준호같네 
navertalk,1.29511E+17,Thu Oct 27 19:53:46 KST 2011,alzam37,bugbear5,@bugbear5 뭐 케티도 카톡없이는 안된다는거 알거고 출시한다는건 카톡이 나온단 확신이 있겠지요 글고 와츠앱이 있으니 당장은 큰문제가 아니고..,뭐 케티 케티 케티도 카톡없 안된다는거 알거 알거 알거고 출시한다는건 카톡 카톡 카톡이 나온단 확신 있 글고 와츠앱이 있 당장 큰문제 큰문제 큰문제가 아니 아 아니 아 ,뭐 케티 케티 케티도 카톡없 안된다는거 알거 알거 알거고 출시한다는건 카톡 카톡 카톡이 나온단 확신 있 글고 와츠앱이 있 당장 큰문제 큰문제 큰문제가 아니 아 아니 아 
navertalk,1.29511E+17,Thu Oct 27 19:53:44 KST 2011,hsyhsy0325,null,생각해보니까 담임이 내 카톡 드심 ㅋㅋ,생각 담 담임 담 내 내 내 내 카톡 들 tagsmile ,생각 담 담임 담 내 내 내 내 카톡 들 tagsmile 
navertalk,1.29511E+17,Thu Oct 27 19:53:37 KST 2011,esjung7,dohkuro,@dohkuro ㅋㅋㅋ 나는 카톡보다 나은거 같다 너 두시에 보낸 카톡 지금 왔다 ㅡㅡ;;,tagsmile 나 나 나 나 카톡 카톡보 나은거 같 너 두시 두시 두시에 보내 카톡 지금 오 tagcry ,tagsmile 나 나 나 나 카톡 카톡보 나은거 같 두시 두시 두시에 보내 카톡 지금 오 tagcry 
navertalk,1.29511E+17,Thu Oct 27 19:53:34 KST 2011,MJ_kimna,Dongwook0926,@Dongwook0926 동욱아누나한테카톡해ㅋ,동욱아누나한테카톡 tagsmile ,동욱아누나한테카톡 tagsmile 
navertalk,1.29511E+17,Thu Oct 27 19:53:26 KST 2011,letssmile365,null,카카오톡 대화로 본 ‘2030의 반란’ http://t.co/EAeCzUWb,카카오톡 대화 본 보 보 2030 2030 2030의 반란 ,카카오톡 대화 본 보 보 2030 2030 2030의 반란 
navertalk,1.29511E+17,Thu Oct 27 19:53:24 KST 2011,bella221207,B1A4_JINYOUNG,@B1A4_JINYOUNG 아는 바나 언니한테 오빠들 나온다는 카톡 받고 바로 고화질봐꾸고 보느라구요 ㅠㅠ 그래도 무대가 완벽해서 너무 좋았어요! 오빠 저는 인제 자야되요 ㅠ  감기 조심하시구~ 오빠도 오늘 좋은 꿈 꾸세여!!  ♥♥♥♥♥♥,아 바 언니한테 오빠 나 카톡 받 바 고화질봐꾸 보느라구 보느라구 보느라구요 tagcry 그래 무대가 무대 무대 완벽 너무 좋 tagexclamation 오빠 저 인제 자 자 자야되 자야 자야되 자야되요 tagcry 감기 감 감 가 조심하시구 오빠 오늘 좋 꿈 꾸 꾸 꾸 꾸세 꾸세여 tagexclamation taglove ,아 바 언니한테 오빠 나 카톡 받 바 고화질봐꾸 보느라구 보느라구 보느라구요 tagcry 무대가 무대 무대 완벽 좋 tagexclamation 오빠 저 인제 자 자 자야되 자야 자야되 자야되요 tagcry 감기 감 감 가 조심하시구 오빠 오늘 좋 꿈 꾸 꾸 꾸 꾸세 꾸세여 tagexclamation taglove 
navertalk,1.29511E+17,Thu Oct 27 19:53:19 KST 2011,iruu86,oha86,@oha86 ㅋㅋㅋ 카톡이나 쪽지로 키 날려줘봐.ㅎ,tagsmile 카톡 카톡 카톡이 쪽지 키 날려줘봐 tagsmile ,tagsmile 카톡 카톡 카톡이 쪽지 키 날려줘봐 tagsmile 
navertalk,1.29511E+17,Thu Oct 27 19:53:06 KST 2011,xtion_j,delicatesong,@delicatesong 전화도 먹통 카톡도 먹통,전화 먹통 카톡 카톡 카톡도 먹통 ,전화 먹통 카톡 카톡 카톡도 먹통 
navertalk,1.29511E+17,Thu Oct 27 19:53:02 KST 2011,Pinwheel1004,NewHeart1225,@NewHeart1225 형 카톡아이디가 뭐였지?,형 카톡아 카톡아이디 카톡아이디 카톡아이디가 뭐 tagquestion ,형 카톡아 카톡아이디 카톡아이디 카톡아이디가 뭐 tagquestion 
navertalk,1.29511E+17,Thu Oct 27 19:52:56 KST 2011,Superior_silver,abidingyean,@abidingyean ㅋㅋㅋㅋ 카톡사진이 바꼇어 ㅋㅋ,tagsmile 카톡사진 바꼇어 tagsmile ,tagsmile 카톡사진 바꼇어 tagsmile 
navertalk,1.29511E+17,Thu Oct 27 19:52:43 KST 2011,UHyeon09,Heeheehong,@Heeheehong 그리고집에왔는데카톡상태메세지에 친한척ㅃㅃ이렇계되있었던,그리고집에왔는데카톡상태메세지 친한척 ㅃㅃ 이렇계되있었던 ,그리고집에왔는데카톡상태메세지 친한척 ㅃㅃ 이렇계되있었던 
navertalk,1.29511E+17,Thu Oct 27 19:52:37 KST 2011,JWbuffalo,Dino_Dooly,@Dino_Dooly 잡아먹겟단 소리군ㅋㅋㅋ 언제볼랭? (디엠으로 카톡아이디 ㄱㄱ,잡아먹겟단 소리군 tagsmile 언제볼랭 tagquestion 디엠 디엠으 카톡 카톡아 카톡아 카톡아이디 ㄱㄱ ,잡아먹겟단 소리군 tagsmile 언제볼랭 tagquestion 디엠 디엠으 카톡 카톡아 카톡아 카톡아이디 ㄱㄱ 
navertalk,1.29511E+17,Thu Oct 27 19:52:34 KST 2011,kurimu_408,null,[봇] Kurimu쨩 카톡ID : kurimu408 / 말놓고 싶으시다면 언제든지 멘션주세요!! ^^ #트위터봇,봇 kurimu쨩 카톡id kurimu408 말놓 싶 언제 멘션주세 멘션주세 멘션주세요 tagexclamation tagsmile 트위터봇 ,봇 kurimu쨩 카톡id kurimu408 말놓 싶 언제 멘션주세 멘션주세 멘션주세요 tagexclamation tagsmile 트위터봇 
navertalk,1.29511E+17,Thu Oct 27 19:52:14 KST 2011,lshyeon19,simple0708,@simple0708 오오옹오오ㅗ오!!!! lshyeon19 이거내카톡이까여기루번호보내죠~♥,오오옹오오 ㅗ 오 tagexclamation lshyeon19 이거내카톡이까여기루번호보내죠 taglove ,오오옹오오 ㅗ 오 tagexclamation lshyeon19 이거내카톡이까여기루번호보내죠 taglove 
navertalk,1.29511E+17,Thu Oct 27 19:52:09 KST 2011,flowerpigxx,sxnyqhia,@sxnyqhia 저는 카톡으로!!,저 카톡 카톡으 tagexclamation ,저 카톡 카톡으 tagexclamation 
navertalk,1.29511E+17,Thu Oct 27 19:51:58 KST 2011,HRS2WS,null,띵똥! RT @chy6085: 트위터～RT @_rendy90 제일먼저 어떤 어플을 깔까? 트위터? 페이스북? 카톡/왓챕?,띵똥 tagexclamation 트위터 제일먼저 어떤 어플 어플 어플을 까 tagquestion 트위터 tagquestion 페이스북 tagquestion 카톡 왓챕 tagquestion ,띵똥 tagexclamation 트위터 제일먼저 어떤 어플 어플 어플을 까 tagquestion 트위터 tagquestion 페이스북 tagquestion 카톡 왓챕 tagquestion 
navertalk,1.29511E+17,Thu Oct 27 19:51:57 KST 2011,PoseiJeon,SeulJae,@SeulJae 빵년 주제에 논리있게 말하는 것처럼 보이려고 존나 따박따박대는 거 귀찮아서 놔뒀는데 그냥 지금 카톡 또 했음.... '입금 더 안 하실 거죠?' 라고 해서 또 따지려고 들면 그냥 관두라고 하려고 ㅋㅋㅋㅋㅋㅋㅋㅋ,빵년 주제 논리 논 말 말 것 보 조 졸 존 존나 따박따박대 거 거 거 거 귀찮 놔두 그냥 지금 카톡 또 하 하 입금 더 안 알 알 하실 거죠 tagquestion 라 라 라고 해서 하 하 하 또 따 들 그냥 관두 하 하 tagsmile ,빵년 주제 논리 논 말 말 것 보 조 졸 존 존나 따박따박대 거 거 거 거 귀찮 놔두 지금 카톡 또 하 하 입금 안 알 알 하실 거죠 tagquestion 라 라 라고 해서 하 하 하 또 따 들 관두 하 하 tagsmile 
navertalk,1.29511E+17,Thu Oct 27 19:51:42 KST 2011,dawn1ng,hhhongso,@hhhongso 역시 날 예뽀하는거야 시럽도 크림도 많2많2 근데 우리 이런얘기 카톡으로 해도되는데 왜 트윗으로 하는걸가,역시 날 나 나 나 예뽀하는거 예뽀하는거 예뽀하는거야 시럽 크림 많2 많2 근데 우리 이런얘기 카톡 카톡으 해도되는데 왜 외 외 트윗 트윗으 하는걸가 ,역시 날 나 나 나 예뽀하는거 예뽀하는거 예뽀하는거야 시럽 크림 많2 많2 근데 우리 이런얘기 카톡 카톡으 해도되는데 왜 외 외 트윗 트윗으 하는걸가 
navertalk,1.29511E+17,Thu Oct 27 19:51:32 KST 2011,chy6085,null,트위터～RT @_rendy90 제일먼저 어떤 어플을 깔까? 트위터? 페이스북? 카톡/왓챕?,트위터 제일먼저 어떤 어플 어플 어플을 까 tagquestion 트위터 tagquestion 페이스북 tagquestion 카톡 왓챕 tagquestion ,트위터 제일먼저 어떤 어플 어플 어플을 까 tagquestion 트위터 tagquestion 페이스북 tagquestion 카톡 왓챕 tagquestion 
navertalk,1.29511E+17,Thu Oct 27 19:51:30 KST 2011,_pinkky2,seawrd614,@seawrd614 웅 카톡 답장이 없네여...,웅 카톡 답장 없 ,웅 카톡 답장 없 
navertalk,1.29511E+17,Thu Oct 27 19:51:27 KST 2011,JAENGNEU,null,"★ 아근데, 카톡...에 보내지는.ㅋㅋㅋㅋ 오빠들사진 왜이렇게 겁나 이쁘나뇽?ㅋㅋㅋㅋ",아근데 카톡 에 보내 보 tagsmile 오빠들사진 왜이렇게 겁나 이쁘나뇽 tagquestion tagsmile ,아근데 카톡 보내 보 tagsmile 오빠들사진 왜이렇게 겁나 이쁘나뇽 tagquestion tagsmile 
navertalk,1.2951E+17,Thu Oct 27 19:51:03 KST 2011,Miniberry_kr,DCtamago_,@DCtamago_ 카톡 플친 버거킹에서 할로윈 쿠폰 보내줬뜸! 근데 버거킹이 없뜸!,카톡 플친 버거킹 할로윈 쿠폰 보내줬뜸 tagexclamation 근데 버거킹 버거킹 버거킹이 없뜸 tagexclamation ,카톡 플친 버거킹 할로윈 쿠폰 보내줬뜸 tagexclamation 근데 버거킹 버거킹 버거킹이 없뜸 tagexclamation 
navertalk,1.2951E+17,Thu Oct 27 19:50:50 KST 2011,seipza,Little_Dew,@little_dew @nodoubtzico ㅋㅋㅋㅋㅋㅋㅋㅋㅋㅋㅋㅋㅋ누나 친추자체가 안대서  카톡업글햇더니 채팅창날라갓으옄ㅋㅋㅋㅋㅋ,tagsmile 누나 누 누 누 누 친추자체 알 카톡업글햇더 카톡업글햇더 카톡업글햇더니 채팅창날라갓으옄 tagsmile ,tagsmile 누나 누 누 누 누 친추자체 알 카톡업글햇더 카톡업글햇더 카톡업글햇더니 채팅창날라갓으옄 tagsmile 
navertalk,1.2951E+17,Thu Oct 27 19:50:30 KST 2011,Julie7110,_rendy90,@_rendy90 카톡,카톡 ,카톡 
navertalk,1.2951E+17,Thu Oct 27 19:50:11 KST 2011,maki113j,jinah8616,"@jinah8616 경기도 알아영!! 나 홋카이도 삿포로요! 아세영??^,~ 아 근데 언니는 카톡해요?",경기 알아영 tagexclamation 나 나 나 나 홋카 홋카이 홋카이 홋카이도 삿포 삿포로 삿포로 삿포로요 tagexclamation 아세영 tagquestion 아 근데 언니 카톡 카톡 카톡해 카톡 카톡해 카톡해요 tagquestion ,경기 알아영 tagexclamation 나 나 나 나 홋카 홋카이 홋카이 홋카이도 삿포 삿포로 삿포로 삿포로요 tagexclamation 아세영 tagquestion 아 근데 언니 카톡 카톡 카톡해 카톡 카톡해 카톡해요 tagquestion 
navertalk,1.2951E+17,Thu Oct 27 19:50:04 KST 2011,SaSInLee,JYOUNG__z,@JYOUNG__z #muzogun 바뻣냐?오늘오빠한테카톡도안보내구!!,muzogun 바뻣냐 tagquestion 오늘오빠한테카톡도안보내구 tagexclamation ,muzogun 바뻣냐 tagquestion 오늘오빠한테카톡도안보내구 tagexclamation 
navertalk,1.2951E+17,Thu Oct 27 19:49:54 KST 2011,Battybae,null,카톡 왜 안되니.,카톡 왜 외 외 안 ,카톡 왜 외 외 안 
